,Question,Answer
0,How does the Swampland program aim to distinguish between effective theories that can be completed into quantum gravity in the UV and those that cannot?,"The Swampland program works on the premise that certain theories which are effective at lower energy scales may not be consistent or complete when probed at higher energy scales, particularly those relevant to quantum gravity. By analyzing various criteria and conjectures such as the Weak Gravity Conjecture, compactifications of String Theory, and the de Sitter conjecture, researchers aim to discern which theories belong to the ""Swampland"" of incomplete theories incompatible with a UV completion."
1,"What role does self-consistency play in understanding physical theories, especially at high energy scales relevant to quantum gravity?","Self-consistency serves as a crucial tool in understanding physical theories, with its power increasing at higher energy scales where empirical tests become harder to perform. In the realm of Quantum Field Theory, anomalies are an example of self-consistency principles that restrict the particle spectra. At energies relevant to quantum gravity, self-consistency can be strong enough to uniquely determine properties of the theory, as exemplified in string theory where properties like the dimension of spacetime are almost uniquely fixed at the string scale."
2,How does self-consistency differ in its effectiveness at low energies compared to high energies in theories involving gravity?,"At low energies, self-consistency becomes less powerful even in theories that incorporate gravity. This means that at lower energy scales, theories might have more degrees of freedom or parameter choices that are not uniquely fixed by self-consistency principles alone. However, at higher energies, especially those relevant to quantum gravity, self-consistency can play a dominant role in determining the structure of the theory, potentially providing strong constraints and unique solutions to certain properties of the theory, as observed in string theory at the string scale."
3,How does the concept of the String Theory Landscape relate to the existence of multiple low-energy effective theories in string theory?,"The String Theory Landscape refers to the vast number of low-energy effective theories that arise from the rich vacuum structure of string theory. Each effective theory corresponds to a different vacuum of string theory, resulting in a diverse spectrum of possible theories."
4,What distinguishes the theories within the Swampland from those within the Landscape in terms of their consistency with quantum gravity?,"The Swampland consists of effective field theories that appear consistent at low energies but cannot be completed into a quantum gravity theory in the ultraviolet regime. The theories in the Landscape, on the other hand, are those which are self-consistent at low energies and can potentially be connected to a complete theory of quantum gravity."
5,How does the concept of the Swampland in string theory provide constraints on the effective theories that can arise from it?,"The Swampland concept in string theory imposes constraints on the set of effective theories that can be derived from it. It signifies that not all apparently self-consistent effective theories at low energies can be extended into a complete quantum gravity theory in the ultraviolet, thus limiting the allowed possibilities within the realm of effective field theories."
6,"What is the relationship between the general quantum theory of gravity, string theory, the Swampland, and the Landscape mentioned in the text?","The text discusses the relationship between the general quantum theory of gravity and string theory by noting that they are often interchangeable in notation. It also introduces the concepts of the Swampland and the Landscape, with the Swampland representing theories that are not viable in a fundamental sense, and the Landscape representing viable theories."
7,"How are criteria for determining whether a theory belongs in the Landscape or the Swampland formulated, and what challenges are associated with this formulation?","The text mentions that criteria for distinguishing between theories in the Landscape and those in the Swampland should be formulated based on properties of the low-energy effective theory itself, without reference to the theory's ultraviolet origin. This formulation faces challenges as it is a difficult task and not all proposed criteria are equally supported by evidence or have the same implications."
8,"What role do known vacua of string theory play in providing evidence for Swampland conjectures, and what challenges are associated with using these vacua as experimental data?","The text explains that one approach to supporting Swampland conjectures is by using known vacua of string theory as a form of experimental data. If all known vacua satisfy a conjecture, then it is considered supported by string theory data. However, this approach faces challenges as known vacua of string theory vary in their levels of rigour, with some having a full string world-sheet description, while others involve numerous assumptions."
9,What is the significance of uncovering an ultraviolet principle of string theory in the context of the Swampland criteria?,Uncovering an ultraviolet principle of string theory that was previously missed or not fully appreciated could directly lead to establishing the Swampland criteria. This discovery would provide a more direct route to understanding the constraints imposed by the Swampland criteria compared to the current indirect arguments based on data from string theory vacua. It is considered a big-picture aim of the Swampland program to reveal new underlying microscopic physics that could advance our understanding of the nature of quantum gravity.
10,How are the various Swampland criteria related and why is it significant that they are part of an interconnected structure?,"The different Swampland criteria, initially appearing unrelated, have been increasingly recognized to form an interconnected structure. This interconnectedness is crucial because it suggests a unified framework governing the criteria, which enhances our understanding of the constraints on effective quantum field theories coupled to gravity. Recognizing this interconnected structure helps elucidate the relationships among different criteria and reinforces the consistency and reliability of the Swampland program."
11,"In what way do string theory constructions, quantum gravity arguments, and microscopic physics contribute to establishing evidence for constraints in the Swampland program?","The Swampland program draws evidence from three main sources: string theory constructions, quantum gravity arguments, and insights from microscopic physics. String theory constructions provide frameworks for exploring various string vacua and their properties. Quantum gravity arguments help establish the fundamental principles that govern gravitational interactions in the quantum realm. Microscopic physics reveals the underlying mechanisms at play in quantum systems. By integrating these perspectives, the Swampland program aims to develop a comprehensive understanding of the constraints that effective quantum field theories coupled to gravity must satisfy, leading to a more robust framework for fundamental physics."
12,How is the concept of the Planck mass and the scale $Lambda_{\mathrm{Swamp}} related in the context of coupling theories to gravity?,"In the text, the idea of coupling theories to gravity is discussed in relation to the Planck mass $M_p$ and the scale $Lambda_{\mathrm{Swamp}}. The finite gravitational strength, represented by the Planck mass, influences the theory's behavior at energy scales above $Lambda_{\mathrm{Swamp}} where modifications might be necessary to maintain consistency with quantum gravity."
13,How does the scale $Lambda_{\mathrm{Swamp}} impact the behavior of the effective quantum field theory at different energy scales?,"The scale $Lambda_{\mathrm{Swamp}} serves as a critical point where the theory may require modifications for consistency with quantum gravity at ultraviolet energies. Depending on its relationship with the scale $Lambda_{\mathrm{QFT}} and the Planck mass, $Lambda_{\mathrm{Swamp}} can significantly affect the low-energy behavior of the theory and may render it inconsistent if not appropriately accounted for."
14,"How does the behavior of $Lambda_{\mathrm{Swamp}} change as the Planck mass tends towards infinity, and how does it impact the theory under different parameter values?","When the Planck mass $M_p$ approaches infinity, $Lambda_{\mathrm{Swamp}} also tends towards infinity, as expected due to the connection to gravity coupling. The relative values of $Lambda_{\mathrm{Swamp}},  $Lambda_{\mathrm{QFT}}, and $M_p can lead to diverse scenarios, with $Lambda_{\mathrm{Swamp}} potentially being much smaller than $Lambda_{\mathrm{QFT}} and influencing the theory's behavior at low energies, drawing specific interest to setups exhibiting such characteristics."
15,"How is the Swampland program connected to string theory, and to what extent is it dependent on it?","The Swampland program is heavily guided by string theory, as almost all of its aspects are influenced by string theory in one way or another. While string theory plays a crucial role in guiding the Swampland program, it is not necessarily tied to string theory alone. Some of the motivations and criteria in the Swampland program can be understood independently of string theory, though string theory provides a valuable framework for exploration."
16,"What is the importance of understanding the Swampland criteria in the context of quantum gravity, and how does it relate to modern theories like holography?","Understanding the Swampland criteria is crucial in the context of quantum gravity as it provides insights into the limitations and constraints on consistent quantum theories of gravity. The Swampland program, while largely influenced by string theory, also has connections to other modern theories like holography. Modern forms of holography in spaces like anti-de Sitter space were initially discovered through string theory but have broader implications for quantum gravitational theories beyond just strings."
17,"In what ways does the Swampland program differ from traditional fields of theoretical physics, and what are the challenges researchers face in this relatively early stage field?","The Swampland program differs from traditional fields of theoretical physics by not being easily reviewed based on derivable, provable results from underlying axioms. Instead, it is currently more of a collection of arguments and proposals about the Swampland, with the main focus being on establishing the microscopic physics underlying the Swampland results. Challenges researchers face in this early stage field include identifying candidates for underlying ideas and physics, as well as developing methods to test these proposals and ideas."
18,What is the Swampland program in theoretical physics and why is it important in the context of string theory?,"The Swampland program in theoretical physics is a set of conjectures and criteria that aim to distinguish effective field theories that can be consistently embedded into a theory of quantum gravity from those that cannot. It is important in the context of string theory as it provides a framework for exploring the landscape of consistent quantum gravity theories and identifying properties that theories in the ""Swampland"" should possess."
19,How does the review mentioned in the text contribute to our understanding of the Swampland criteria and string theory tests?,"The review mentioned in the text contributes to our understanding by presenting a comprehensive collection of arguments and proposals about the Swampland criteria from various sources. It helps readers judge the strength of the evidence supporting these criteria. Additionally, the review introduces string theory tests of the criteria through detailed and pedagogical examples, providing a solid foundation for exploring more complex scenarios in the field."
20,Can you elaborate on the significance of the proposal based on emergence for the microscopic physics underlying some of the primary Swampland criteria mentioned in the text?,"The proposal based on emergence suggests a perspective where the fundamental properties of the Swampland criteria arise from underlying microscopic degrees of freedom through emergent phenomena. By exploring this proposal, researchers aim to understand how macroscopic features of quantum gravity theories, such as the Swampland criteria, could emerge from a more fundamental microscopic description. This approach offers insights into the potential fundamental nature of the Swampland criteria and their connections to underlying quantum gravity theories."
21,"What are the de Sitter and refined de Sitter conjectures, and how are they discussed in the provided text?","The de Sitter and refined de Sitter conjectures are key ideas in theoretical physics related to the cosmological constant problem and the structure of spacetime in the universe. These conjectures suggest constraints on the viability of de Sitter space in a quantum theory of gravity. In the text, the discussion of the de Sitter and refined de Sitter conjectures likely includes their formulation, implications, and possible resolutions within the context of the Swampland program."
22,"How is the reduced Planck mass defined in $d$-dimensions, and why is it significant in the context of quantum gravity?","In the text, the reduced Planck mass in $d$-dimensions, denoted as $M_p^d$, is defined as the coefficient in front of the $d$-dimensional Ricci scalar in the action. This quantity plays a crucial role in quantum gravity as it characterizes the strength of gravitational interactions in $d$ dimensions. By setting $M_p^d=1$ in a $d$-dimensional theory and relating it to the four-dimensional Planck mass, researchers can investigate the gravitational behavior and energy scales of the theory in a consistent manner."
23,"How is the Swampland distance conjecture introduced in the text, and what does it entail in the context of string theory?","The Swampland distance conjecture, as encountered in section sec:fcsdc of the text, is typically discussed in the framework of string theory. By considering dimensional reduction of the bosonic string on a circle, researchers can delve into the implications of the Swampland distance conjecture, which provides insights into the properties of quantum gravitational theories and the constraints they impose on effective field theories. Understanding this conjecture is crucial for exploring the Swampland program and its implications for the consistency of quantum gravity theories."
24,What is the significance of the Swampland distance conjecture and how does it relate to the Weak Gravity Conjecture in theoretical physics?,"The Swampland distance conjecture is a proposition in theoretical physics that puts restrictions on the effective field theories that can arise from consistent theories of quantum gravity. It posits that in any quantum theory of gravity, there must be light states that can propagate over distances that grow with a negative power of the UV cutoff. The Weak Gravity Conjecture, on the other hand, suggests that in any consistent theory of quantum gravity coupled to gauge fields, gravity must be the weakest force. The connection between the Swampland distance conjecture and the Weak Gravity Conjecture lies in the fact that exhibiting the physics associated with the Weak Gravity Conjecture can provide insights into the Swampland distance conjecture."
25,How does the concept of the Species scale introduced in the text relate to our understanding of string theory and fundamental physics?,"The Species scale is a concept that arises in the context of string theory, representing the fundamental scale at which different species of particles affect the gravitational force. Introducing the idea of the Species scale can lead to a better comprehension of how various particle species interact within the framework of string theory. It can shed light on questions related to the hierarchy of particles, the gravitational effects of different species, and their implications for the overall structure of the theory."
26,Can you explain how the Nambu-Goto action is utilized to describe the motion of a point particle in the context of string theory's approach to particle dynamics?,"The Nambu-Goto action is an integral over the worldline of a moving particle and is used to describe the dynamics of point particles within the framework of string theory. This action is based on the principle that the action should be proportional to the length of the worldline traversed by the particle in spacetime. By evaluating the Nambu-Goto action, one can derive the equations of motion for the particle, capturing its behavior as it moves through spacetime according to the principles of string theory."
27,How does the Nambu-Goto action equation demonstrate that the parameter $m$ represents the mass of the particle?,"The Nambu-Goto action equation is given as $p^2 + m^2 = 0$. This equation shows that the parameter $m$ is indeed the mass of the particle because it satisfies the mass-shell condition where the momentum squared plus the mass squared equals zero, indicating the rest energy of the particle. This relationship between $m$ and the mass of the particle is significant for understanding the dynamics of the system."
28,"What is the significance of the Polyakov action in comparison to the Nambu-Goto action, and why is it considered easier to quantize?","The Polyakov action is another way to describe the dynamics of a particle and is classically equivalent to the Nambu-Goto action. However, the Polyakov action is considered easier to quantize because it involves an additional degree of freedom, the world-line metric $e(\tau)$, which can simplify the quantization process. By incorporating this additional degree of freedom, the Polyakov action offers a more convenient framework for certain calculations and theoretical investigations in string theory."
29,"How does the world-sheet parameterization in the context of a string differ from the particle's world-line parameterization, and why is it relevant in string theory?","In the context of a string, the two-dimensional worldsheet parameterized by coordinates $\left(\sigma,\tau\right)$ differs from the one-dimensional world-line parameterization of a particle. This distinction is significant in string theory because the worldsheet provides a platform to describe not only the motion of the string in spacetime but also its internal dynamics. By studying how the string sweeps out this worldsheet in spacetime, researchers can analyze various string configurations and properties, leading to a deeper understanding of string theory as a fundamental framework in theoretical physics."
30,How is the dynamics of a string described through the Polyakov action?,"The dynamics of a string are described through the Polyakov action, denoted as \( S_P \), given by the equation \[ S_P = -\frac{T}{2} \int_{\Sigma} d^2 \xi \left( - \mathrm{det}\; h \right)^{\frac{1}{2}} h^{ab}(\xi) \partial_a X^{\mu}(\xi) \partial_b X^{u}(\xi) \eta_{\mu u}, \] where \( T \) is the string tension, \( h_{ab}(\xi) \) is the worldsheet metric, and \( X^{\mu}(\xi) \) are scalar fields on the string worldsheet."
31,"What are the string tension, string length, and string scale, and how are they related to each other?","The string tension \( T \) is related to a parameter \( \alpha' \) as \( T = \frac{1}{2\pi\alpha'} \). The string length is defined as \( l_s = \sqrt{\alpha'} \), and the string scale is defined as \( M_s = \frac{1}{2\pi\sqrt{\alpha'}} \). These quantities are related through the string tension and the parameter \( \alpha' \)."
32,"How are sigma models defined in the context of string theory, and what is the significance of the target space in the context of sigma models?","In the context of string theory, sigma models are two-dimensional theories with scalar fields \( X^{\mu}(\xi) \), describing the dynamics of strings. The target space of the worldsheet theory refers to the space-time in which the string propagates, parameterized by the scalar fields \( X^{\mu} \). The metric on the target space, denoted by \( \eta_{\mu u} \), affects the dynamics of the strings, as strings propagating in different target spaces with different metrics will behave differently due to the metric on the scalar field spaces."
33,How do diffeomorphisms and Weyl transformations affect the invariance of the worldsheet theory under Paction?,"Diffeomorphisms and Weyl transformations are crucial symmetries of the worldsheet theory under the Paction. Diffeomorphisms involve local transformations of the worldsheet coordinates, while Weyl transformations modify the worldsheet metric by a conformal factor. The invariance of the Paction under these transformations ensures the consistency and stability of the string theory."
34,What is the significance of the Virasoro constraint in the context of string theory and how does it relate to the equations of motion for the metric?,"The Virasoro constraint, arising from the vanishing of the energy-momentum tensor in the theory, plays a fundamental role in string theory, especially during the quantization process. The constraint, represented by T_{ab} = 0, is derived from the action principle and ensures the physical consistency of the theory. It corresponds to the equations of motion for the metric and needs to be satisfied in order for the string theory to be well-defined."
35,"How does the number of symmetry parameters compare to the degrees of freedom of the metric in the context of a D-dimensional theory, particularly for the case of D=2 representing a string?","In a D-dimensional theory, the number of symmetry parameters, including diffeomorphisms and Weyl transformations, can be compared to the degrees of freedom of the metric. For D=2, which corresponds to a string theory, the number of symmetry parameters matches the degrees of freedom of the metric. This special case allows for the metric to be set to a specific flat gauge, simplifying the analysis and making the theory more tractable."
36,Can you explain the significance of imposing the Virasoro constraints in the context of string theory?,"Imposing the Virasoro constraints in string theory is crucial as they arise from requiring the theory to be consistent and free of anomalies. These constraints help determine the dynamics of the strings, constrain the form of the equations of motion, and lead to the emergence of physical observables."
37,How does the target-space light-cone gauge affect the number of physical degrees of freedom in the theory?,"In the target-space light-cone gauge, such as the one described in the text, the oscillators in the $X^-$ direction become dependent on the transverse oscillators in $X^i$. As a result, only the oscillators in the transverse directions remain as physically independent degrees of freedom. This gauge choice effectively eliminates unphysical oscillations, similar to how only two polarizations are physical in a Maxwell field in four dimensions."
38,Can you elaborate on the process of quantization in string theory and how it relates to canonical commutation relations?,"In the process of quantizing a string theory, we promote the oscillator modes to operators acting on a Hilbert space. Canonical commutation relations are crucial in this quantization process, as they dictate how the position and momentum operators for the string oscillators should behave. These commutation relations define the algebra satisfied by the operators and play a fundamental role in constructing the quantum theory of strings."
39,How are the generators of Lorentz transformations defined in the text and what is their significance in theoretical physics?,"The generators of Lorentz transformations are defined as $J^{\mu u} = \int_0^{2\pi} d\sigma \left( X^{\mu} \Pi^{ u} - X^{ u}\Pi^{\mu}\right)$ in the text. These generators are crucial in theoretical physics as they describe how space and time coordinates transform under Lorentz transformations, which are key symmetries in relativistic physics."
40,What is the Lorentz algebra presented in the text and how does it reflect the structure of Lorentz transformations?,"The Lorentz algebra provided in the text is given by $[J^{\mu u},J^{\rho\sigma}] = i \eta^{\mu\rho}J^{ u\sigma} + i \eta^{ u \sigma} J^{\mu \rho} - i \eta^{\mu\sigma} J^{ u \rho} -i \eta^{ u\rho} J^{\mu\sigma}$. This algebra showcases the commutation relations between the generators of Lorentz transformations, revealing how different components of Lorentz transformations relate to each other through these commutators."
41,"How does the concept of criticality in string theory, as discussed in the text, relate to the dimensions of spacetime and what implications does it have for string theory?","The text highlights the concept of criticality in string theory, indicating that maintaining Lorentz invariance at the quantum level necessitates the spacetime dimension to be $D=26$. This critical dimensionality constraint is a fundamental result in string theory, indicating that the quantum consistency of the bosonic string requires a specific number of spacetime dimensions. Deviations from this critical dimensionality, such as $D<26$ or $D>26, result in the need to break Lorentz invariance and introduce additional features like a dilaton background or a dilaton potential. These deviations lead to non-critical string theories that are still not fully understood within the framework of string theory."
