,Question,Answer
255,"In what scenarios can the overall periodicity of the potential be made parametrically large, while the size of monotonic regions in the potential remains constant around the Planck scale?","This question pertains to the conditions under which it is possible to have a potential with a large overall periodicity while maintaining constant, small monotonic regions near the Planck scale. It explores the compatibility of such scenarios with the constraints imposed by string theory and implications for theories like the Refined Swampland Distance Conjecture."
256,How does the presence of an obstruction related to energy in the spatial gradient of a scalar field affect the system and lead to gravitational collapse?,"This question involves understanding the role of energy in the spatial gradient of a scalar field in preventing large field variations. The presence of this obstruction can lead to a collapse of the system into a black hole if the energy surpasses a critical threshold, as determined by the Schwarzschild radius."
257,What insights do studies related to the censorship of large spatial field variations in connection to the Swampland Distance Conjecture and axionic Weak Gravity Conjecture provide?,This question directs attention to the broader implications and connections between the censorship of large spatial field variations and fundamental conjectures in theoretical physics such as the Swampland Distance Conjecture and the axionic Weak Gravity Conjecture. Understanding these relationships provides valuable insights into the constraints and behaviors of gravitational theories under various conditions.
258,What is the significance of having a super-Planckian spatial field variation within the Newtonian regime for a scalar field and how does the maximum spatial field variation relate to the radial coordinate in logarithmic spatial profiles?,"The significance of having a super-Planckian spatial field variation within the Newtonian regime implies that the scalar field can have extreme spatial oscillations beyond the typical Planck scale. In the case of a logarithmic spatial profile, the maximum spatial field variation is related to the radial coordinate through a specific logarithmic dependence, indicating constraints on the field behavior."
259,"How do localized solutions charged under a gauge symmetry induce a potential for a scalar field, and what role does the dependence of the gauge coupling on the scalar field play in supporting trans-Planckian field variations?","Localized solutions charged under a gauge symmetry can induce a potential for a scalar field by creating gradients in the scalar field distribution. When the gauge coupling depends on the scalar field, it leads to spatial gradients in the scalar field, which can support trans-Planckian field variations by allowing for exponential increases in energy density, influencing the overall dynamics of the scalar field."
260,"What is the implication of the exponential increase in energy density for self-consistency of solutions involving scalar fields and gauge couplings, and how does it relate to the Weak Gravity Conjecture and the Distance Conjecture in theoretical physics?","The exponential increase in energy density implies that for self-consistency of solutions involving scalar fields and gauge couplings, the cutoff scale of the theory, as set by the Weak Gravity Conjecture scale, must also increase exponentially to stay above the energy density. This leads to important relations such as the GEP, motivating the Distance Conjecture from the Weak Gravity Conjecture. These conjectures have crucial implications for theoretical models, including those related to inflationary scenarios and fundamental aspects of quantum gravity research."
261,"What are the distance conjecture (sdc) and its relation to the axionic Weak Gravity Conjecture (wgcax), and how do they impact models of inflation?","The distance conjecture (sdc) postulates that in any effective field theory coupled to gravity, there exist states of high energy that are separated by a distance in field space greater than the Planck scale. This conjecture suggests that consistent quantum gravity theories should not allow for super-Planckian field excursions. The axionic Weak Gravity Conjecture (wgcax) is closely related and imposes upper bounds on the range and mass scales of scalar fields in a consistent theory of quantum gravity. These conjectures have important implications for models of inflation, particularly limiting large field models where the inflaton undergoes super-Planckian excursions in field space."
262,How do the slow-roll parameters $\epsilon_V$ and $\eta_V$ relate to the Spectral tilt $n_s$ and the tensor-to-scalar ratio $r$ in single-field slow-roll inflation?,"In single-field slow-roll inflation, the slow-roll parameters $\epsilon_V$ and $\eta_V$ play a crucial role in determining the characteristics of the inflationary model. The parameter $\epsilon_V$ is related to the steepness of the potential energy landscape, while $\eta_V$ is associated with the curvature of the potential. These parameters are linked to observational quantities such as the Spectral tilt $n_s$ and the tensor-to-scalar ratio $r$ through specific formulae, where $n_s-1 \simeq 1 + 2 \eta_V - 6 \epsilon_V$ and $r \simeq 16 \epsilon_V$."
263,"How do specific inflation models in string theory relate to the distance conjecture, and why is it important to analyze them in the context of super-Planckian field excursions?","Specific inflation models within the framework of string theory are subject to constraints imposed by the distance conjecture, which prohibits super-Planckian field excursions in a consistent theory of quantum gravity. It is crucial to analyze these inflation models with respect to the distance conjecture to ensure their compatibility with fundamental principles of quantum gravity. Understanding how these models behave in the presence of super-Planckian field excursions helps in assessing their viability within the broader context of string theory and the Swampland program, providing insights into the underlying physics of inflationary scenarios in high-energy physics."
264,How are the potential slow-roll parameters related to the spectral tilt and tensor-to-scalar ratio in the context of inflationary cosmology?,"In the context of inflationary cosmology, the potential slow-roll parameters \(\epsilon_V\) and \(\eta_V\) are related to the spectral tilt \(n_s\) and the tensor-to-scalar ratio \(r\). Specifically, they are related as \(n_s - 1 \simeq 1 + 2\eta_V - 6\epsilon_V\) and \(r \simeq 16\epsilon_V\)."
265,What are the current best constraints on the spectral tilt and tensor-to-scalar ratio parameters based on observational data?,"The current best constraints on the spectral tilt and tensor-to-scalar ratio parameters are \(n_s = 0.9649 \pm 0.0042\) and \(r < 0.064\) respectively, as indicated by observational data."
266,How does the Lyth bound relate the inflaton field excursion to the tensor-to-scalar ratio in inflationary models?,"The Lyth bound, as given by the relation \(\frac{\Delta \phi}{M_p} \gtrsim 0.25\left(\frac{r}{0.01}\right)^{\frac{1}{2}}\), establishes a connection between the inflaton field excursion and the tensor-to-scalar ratio in inflationary models. It implies a lower limit on the field excursion for a given tensor-to-scalar ratio and plays a role in understanding the tensions between the magnitudes of these quantities in the context of model-building and theoretical constraints."
267,"What exactly is the mass scale of the tower of states in the context of the distance conjecture, and how does it impact the controlled models in string theory?","The mass scale of the tower of states in the context of the distance conjecture is defined as $\Lambda_{dc} = A e^{-\alpha \frac{\Delta \phi}{M_p}} M_p$. This mass scale plays a crucial role in building controlled models in string theory. The tension in constructing such models, leading to significant consequences, is influenced by the starting mass scale for the tower of states, which is a key parameter."
268,How do the parameters $n>0$5 and $n>0$6 in the context of the distance conjecture influence the bounds obtained and what role does the cutoff scale play in determining these bounds?,"The parameters $n>0$5 and $n>0$6 play a significant role in determining the bounds in the context of the distance conjecture. By requiring these parameters to satisfy specific conditions, bounds can be obtained. The cutoff scale also plays a crucial role in determining these bounds, with the requirement that it should be larger than just the Hubble scale during inflation."
269,"How does the distance conjecture impact specific models of inflation, such as power-law inflation models or natural inflation, and what does it suggest about the observational bounds?","The distance conjecture places important constraints on specific models of inflation. For instance, in power-law inflation models and natural inflation scenarios, the distance conjecture imposes restrictions on the parameters involved, such as $\alpha^i_{n}$ and $n>0$. It suggests that the bounds derived from the Lyth bound are often underestimated, signifying the strength of the distance conjecture in constraining inflationary models."
270,"What is the main theoretical framework discussed in the text regarding inflation models, and why is it important to consider $n>0$ in this context?","The main theoretical framework discussed in the text is natural inflation, which is based on a specific potential and requires $n>0$ in order to be compatible with spectral tilt bounds. It is important to consider $n>0$ in this context because it affects the viability and consistency of the inflation models with observational constraints."
271,"How does the large axion decay constant in natural inflation models conflict with certain gravitational conjectures, and what implications does this conflict have on the models?","The large axion decay constant in natural inflation models goes against the Weak Gravity Conjecture for axions and violates the distance conjecture. This conflict implies that even when $n>0$ may be very small, the constraints imposed by these conjectures are significant, affecting the overall viability and predictions of the inflation models."
272,"In the context of Starobinsky inflation, what are the requirements for the number of e-foldings and the scenario of eternal inflation, and how do these requirements impact the mass scale of inflation?","In the context of Starobinsky inflation, to achieve 55 e-foldings, $n>0$ is required. Additionally, an eternal inflation scenario necessitates specific conditions on $n>0$. These requirements directly impact the mass scale of inflation and impose strong constraints on parameters like $n>0$ and $X^+$."
273,What are Swampland constraints in the context of string theory and how do they manifest in theoretical physics research?,"Swampland constraints refer to constraints on effective field theories that hold in any consistent theory of quantum gravity. In the context of string theory, these constraints are particularly relevant as they provide insights into the landscape of consistent theories of quantum gravity. Researchers are interested in understanding the implications of Swampland constraints for various theoretical models in string theory and how these constraints affect the bounds on inflation and other cosmological scenarios."
274,How do dualities between different superstring theories contribute to our understanding of M-theory and the landscape of string theory?,"Dualities in string theory play a crucial role in connecting seemingly distinct superstring theories like Type I, Type IIA, Type IIB, Heterotic $X^+$8, and Heterotic $X^+$9. These dualities reveal that these different theories are just different parametrizations of the same underlying theory, often referred to as M-theory. By studying how these superstring theories are interconnected through dualities, researchers gain a deeper understanding of the parameter space of the theory and how different regions of this parameter space provide insights into different regimes of the theory."
275,How does the incorporation of supersymmetry in string theory address non-perturbative instabilities like the tachyon mode and how do different types of superstring theories arise?,"Non-perturbative instabilities in string theory, such as the presence of a tachyon mode, can be resolved by considering supersymmetric extensions of string theory, known as superstrings. By introducing supersymmetry, researchers can stabilize the theory and address these instabilities. The five types of superstring theories  Type I, Type IIA, Type IIB, Heterotic $X^+$8, and Heterotic $X^+$9  emerge as distinct formulations that are all related through dualities, showcasing the unity in the diversity of string theory formulations. Each of these superstring theories captures different aspects of the overarching M-theory, providing complementary descriptions in distinct parameter regimes."
276,Can you explain the significance of considering a single theory with a parameter space in terms of superstring theories?,"Considering a single theory with a parameter space in the context of superstring theories allows us to unify different formulations of string theories by understanding them as different corners of a more general theoretical framework. Different parameterizations of the theory are suitable for different physical regimes, and by exploring the parameter space we can study how superstring theories offer good descriptions in different regions."
277,How do the superstring effective actions differ from the effective action for the massless spectrum of the bosonic string?,"The superstring effective actions are 10-dimensional and contain a broader spectrum of massless fields compared to the effective action for the massless spectrum of the bosonic string. While both types of actions include massless graviton and dilaton fields, the superstring effective actions also incorporate additional fields, such as anti-symmetric forms like the Ramond-Ramond fields that couple to objects known as D-branes."
278,"What is the relationship between 11-dimensional supergravity and M-theory, as mentioned in the text?","In the context of string theory, 11-dimensional supergravity is proposed to be the low-energy limit of M-theory. M-theory is a theoretical framework that unifies different superstring theories, and in its low-energy limit, it reproduces 11-dimensional supergravity. This connection suggests that M-theory provides a more fundamental description that encompasses 11-dimensional supergravity as well as the various superstring theories."
279,What distinguishes a $X^-$2-brane from other types of D-branes in terms of dimensions and behavior in string theories mentioned in the text?,"A $X^-$2-brane is a D-brane that is $X^-$3 dimensional. In Type IIA string theory, $X^-$2-branes correspond to D2-branes, while in Type IIB string theory, they correspond to D1-branes. In Type I string theory, $X^i$2 denotes D1-branes."
280,How are orientifold planes related to other objects in type II string theories in terms of dimensions and charges?,Orientifold planes in type II string theories have the same dimension as certain types of branes in the theory and possess opposite sign charges under the associated field. They are related to $\alpha$5 branes and play a crucial role in canceling charges in these string theories.
281,"How are orientifold planes described as non-dynamical entities in the weak-coupling limit of string theories, and what role do they play in the context of fixed loci for a quotient of the string theory?","Orientifold planes are non-dynamical in the weak-coupling limit of string theories, meaning they do not have their own dynamics and are fixed entities. They correspond to fixed loci for a quotient of the string theory, where an internal involution action ($a$0) acts on the string worldsheet fields and an external involution ($a$1) acts on the geometry. This fixed locus leads to the presence of orientifold planes in the theory."
282,"What is meant by compactification in theoretical physics, particularly in this discussion of constructing effective theories on a circle?","In theoretical physics, compactification refers to considering the background spacetime to be a product space of a non-compact space and a compact space. Specifically, when discussing constructing effective theories on a circle, compactification involves reducing the theory's dimensions by compactifying one or more spatial dimensions down to a circle. This process results in effective lower-dimensional theories being developed at energy scales below the Kaluza-Klein scale of the compact dimensions."
283,How do quantum corrections affect the scalar fields in the context of compactifications that preserve supersymmetry in the lower-dimensional theory?,"When considering compactifications that maintain supersymmetry in the lower-dimensional theory, quantum corrections are expected to affect the scalar fields. In such cases, the scalar fields that parameterize the extra-dimensional geometry, also known as moduli, may remain massless. The expectation values of the exactly massless scalar fields define a field space known as a moduli space. Compactifications preserving at least 8 supercharges are expected to have true moduli spaces where certain scalar fields have no potential even at the non-perturbative level."
284,"What is moduli stabilization, and why is it significant in the context of supersymmetric compactifications to four dimensions?","Moduli stabilization refers to the phenomenon where scalar fields known as moduli, which could potentially be massless in the theory, acquire a fixed value due to the presence of a potential term. In the context of supersymmetric compactifications to four dimensions, moduli stabilization is crucial for understanding the stability and properties of the vacua. It is particularly essential in vacua exhibiting minimal supersymmetry, as it helps in controlling the dynamics and ensuring the stability of the theory. Moduli stabilization is most comprehensively studied in type IIA and IIB string theories, where the potential for the scalar fields can be analyzed and controlled effectively."
285,"What is moduli stabilization and why is it important in string theory, particularly in type IIA and IIB string theories?","Moduli stabilization in string theory refers to the process of fixing the values of the moduli fields in the theory to stabilize the compactification of extra dimensions. In type IIA and IIB string theories, moduli stabilization is crucial because it impacts the structure of the theory and the physical properties of the resulting compactified spacetime."
286,"How does the concept of moduli stabilization relate to the Swampland program, specifically the Swampland Distance Conjecture and the Weak Gravity Conjecture?","Moduli stabilization plays a central role in the Swampland program as it is closely connected to constraints such as the Swampland Distance Conjecture and the Weak Gravity Conjecture. These conjectures provide criteria for whether a given theory lies within the landscape of consistent quantum gravity theories known as the ""Swampland."" Moduli stabilization helps in testing and understanding these conjectures within the framework of string theory."
287,"Can you explain how the Heterotic string theory example, specifically on a six-torus, is used to test the Weak Gravity Conjecture and the role of gauge fields in this context?","The Heterotic string theory on a six-torus serves as a testing ground for the Weak Gravity Conjecture. In this setup, the presence of gauge fields is crucial. The Heterotic string possesses a ten-dimensional gauge group that is typically broken down to its Cartan sub-algebra by Wilson lines on the circles of the torus. This breaking generates additional gauge fields, contributing to a total of 28 gauge fields in four dimensions. These gauge fields are significant in the context of the Weak Gravity Conjecture testing within the Heterotic string theory."
288,How does the breaking of the gauge group in the Heterotic string model lead to the emergence of different states with varying masses and charges?,"In the Heterotic string model, the breaking of the gauge group leads to the emergence of different states. For example, the first massive excitation is the spinor, which has a mass given by $m^2 = \frac{4}{\alpha'}$. Upon reduction on certain dimensions, these states acquire charges populating 16-dimensional charge vectors."
289,How is the gauge coupling related to the dilaton expectation value in the context of the Weak Gravity Conjecture in the Heterotic string?,"In the Heterotic string model, the gauge coupling for the states is related to the dilaton expectation value. The gauge coupling in the Einstein frame, and in Planck units, is given by $g^2 = \frac{2}{\alpha'}$. The dilaton expectation value affects this coupling through a relation analogous to the field-dependence of the gauge coupling."
290,How is the Weak Gravity Conjecture bound modified by the presence of Wilson lines in the Heterotic string model?,"In the Heterotic string model, the Weak Gravity Conjecture bound is modified by the presence of Wilson lines. The presence of Wilson lines, such as the axion, can lead to modifications of the bound. The original bound is given by $m^2 \leq g^2 \left|{\bf q}\right|^2 = \frac{8}{\alpha'}$, but Wilson lines can influence this bound, especially for arbitrary Wilson line expectation values. Testing this bound for various Wilson lines can provide further insights into the dynamics of the system."
291,"What is the behavior of the charge-to-mass ratio as described in the text, and how does it relate to the Weak Gravity Conjecture bound?","The charge-to-mass ratio ${\bf z}$ is given by the expression $|{\bf z}|^2 = \frac{|{\bf q}|^2}{|{\bf q}|^2-2}$. For large charges, this ratio approaches the Weak Gravity Conjecture bound."
292,"How does the spectrum of charged states satisfying the Weak Gravity Conjecture for the Heterotic string behave, and what implication does it have regarding the lattice structure?",The spectrum of charged states that satisfy the Weak Gravity Conjecture for the Heterotic string on $D>26$ forms a lattice. This lattice structure implies the sub-Lattice Weak Gravity Conjecture and also satisfies the Strong Weak Gravity Conjecture.
293,What implications do modular invariance of the world-sheet theory and the NS-NS sector of perturbative string theory have on the Weak Gravity Conjecture for Heterotic strings?,"Modular invariance of the world-sheet theory for the Heterotic string on any manifold implies the existence of a spectrum of charged states that satisfy the Weak Gravity Conjecture. Additionally, the NS-NS sector of any perturbative string theory with $D>26$ contributes to the extension of this conjecture."
294,What is the significance of the Weak Gravity Conjecture and how does it tie into the scenarios discussed in the text?,"The Weak Gravity Conjecture is a conjecture in theoretical physics that suggests that for any consistent theory of quantum gravity coupled to gauge fields, the gravitational force should always be the weakest force in the theory. In the scenarios discussed in the text, the researchers are testing the Weak Gravity Conjecture in various Heterotic settings to explore the implications of compactifying string theories on different manifolds and the resulting effective four-dimensional theories."
295,How do Fayet-Iliopoulos parameters and the convex hull condition relate to the restoration of supersymmetry in the context of Heterotic scenarios as discussed in the text?,"In the context of Heterotic scenarios with multiple branes such as $X^-2, the presence of a Fayet-Iliopoulos parameter can lead to a breaking of supersymmetry. However, the researchers in the text conjectured that there exists a field that can adjust its expectation value to restore supersymmetry in certain compactification scenarios. This adjustment is tied to the convex hull condition, which plays a role in determining the stability of the vacuum and the supersymmetric properties of the theory."
296,"Why are minimally supersymmetric settings important for testing the Weak Gravity Conjecture in string theory, and how does the induced potential for scalar fields play a role in these tests?","Minimally supersymmetric settings are crucial for testing the Weak Gravity Conjecture because they provide a fertile ground for exploring the constraints imposed by the Swampland on the spectrum and interactions of particles in the theory. In such settings, the induced potential for scalar fields becomes particularly relevant as it influences the vacuum structure of the theory. Understanding this potential is essential for evaluating the Swampland constraints in scenarios where axion fields, for example, play a significant role, as their potentials can have important consequences for the behavior of the theory near the vacuum."
