,Question,Answer
171,"What are the key components of the action described in the text, and how do these components interact with the scalar fields?","The action described in the text includes terms for the Ricci scalar $R$, the kinetic terms for scalar fields $t^i$, electromagnetic fields $F^{I}_{\mu\nu}$, and their duals $\star F^{J}_{\mu\nu}$. The scalar fields interact through the metric $g_{ij}(t)$, ${\cal I}_{IJ}(t)$, and ${\cal R}_{IJ}(t)$, which can depend on these fields. The action is extended to include the scalar fields and their interactions with gravity and electromagnetism."
172,How is the Weak Gravity Conjecture (WGC) modified when considering scalar fields with no potential in the context of the action described in the text?,"When considering scalar fields with no potential in the context of the action described in the text, a modified form of the Weak Gravity Conjecture (WGC) bound is derived. The mass of a particle in the theory is constrained by the bound, which includes terms involving the scalar fields and their derivatives. This modification arises from considering the additional attractive force that massless scalar fields can induce on the particle with the largest charge-to-mass ratio."
173,What is the physical interpretation of the additional force term in the modified Weak Gravity Conjecture bound when scalar fields are present?,"The additional force term in the modified Weak Gravity Conjecture bound, arising from the presence of scalar fields, accounts for the attractive force that massless scalar fields can exert on particles in the theory. When the particle couples to the scalar fields, it experiences an additional attractive force, which is quantified by the last term in the modified bound equation. This term ensures that the repulsive force in the theory should be stronger than the aggregate of the attractive forces, including those induced by the scalar fields, on the particle with the largest charge-to-mass ratio."
174,"What does the term ""self-repulsive"" mean in the context of the Weak Gravity Conjecture particles described in the text?","In the context of the Weak Gravity Conjecture particles, the term ""self-repulsive"" refers to the idea that two Weak Gravity Conjecture particles should exert a repulsive force on each other rather than an attractive force, as indicated by the additional force term in the theory."
175,"How is the interaction strength, denoted by the term $\mu$, derived in the effective Lagrangian for the given scalar field and particle?","The interaction strength $\mu$ is derived by evaluating the derivative of the mass term for the scalar field in the vacuum, which is represented by the expression $\mu = \left< \partial_{\phi} m \right>$. This derivation provides the coupling constant that characterizes the interaction between the scalar field and particle."
176,"How does the scalar mediated force, as given in the text, compare with the gravitational and electromagnetic forces in terms of their relative magnitudes?","The scalar mediated force, represented as $F_{\mathrm{Scalar}} = \frac{\mu^2}{4 \pi r^2}$ in the text, can be compared with the gravitational and electromagnetic forces to understand their relative magnitudes. By examining these forces, one can verify how the Weak Gravity Conjecture captures the relative strength of these interactions and whether they exhibit self-repulsive behavior."
177,"What is the Weak Gravity Conjecture, and how was it motivated by the discharge of black holes in the case of Reissner-Nordstrom black holes with scalar fields involved?","The Weak Gravity Conjecture (WGC) is a theory in theoretical physics asserting that in any consistent quantum field theory coupled to gravity, there must exist a particle with charge-to-mass ratio exceeding the extremality bound of a black hole. It was motivated by the discharge of black holes, particularly the Reissner-Nordstrom black holes with scalar fields, where the black hole solutions can be modified due to the presence of secondary scalar ""hair"" causing sensitivity to scalar fields through their appearance in the gauge couplings of gauge fields."
178,"How does the Attractor Mechanism come into play in the context of black hole solutions and scalar fields, and why is it significant in the study of extremal black holes?","The Attractor Mechanism is a well-studied effect related to black hole solutions with scalar fields, where the scalar fields develop fixed values near the black hole horizon known as attractor values. This mechanism, often studied for supersymmetric solutions, is significant as it ensures extremal black hole solutions to the action satisfy specific relations, such as the one expressed in the equation ${\cal Q}^2 = M_{\mathrm{ADM}}^2 + g^{ij} \left(\partial_i M_{\mathrm{ADM}}\right) \left(\partial_j M_{\mathrm{ADM}}\right)$, indicating a connection to the WGC and discharge of black holes."
179,"How do spatially varying profiles of scalar fields impact the relationship expressed in Equation (gWGCmadm), and why is it necessary to consider this in the context of extremal black holes and the Weak Gravity Conjecture?","In the context of extremal black holes and the Weak Gravity Conjecture, it is essential to consider that the scalar fields may have spatially varying profiles when examining the relationship captured by Equation (gWGCmadm). This is critical because the relation holds at infinity where the scalar fields assume their attractor values, crucial for the stability of extremal black hole solutions. The spatial variation of scalar fields influences the behavior of the black hole solutions and their fulfillment of the WGC criteria related to charge-to-mass ratios."
180,How does the dependence of black hole mass on scalar fields differ from the dependence of particle mass on those fields in the context described in the text?,The text mentions that the dependence of the black hole mass on scalar fields may generally differ from the dependence of the particle mass on those fields. This discrepancy can make it challenging to establish a direct relation between the statement for black holes and particles in this scenario.
181,What specific symmetries and constraints are imposed in the variant of the action described for the dilaton black hole in the text?,"In the text, the action for the dilaton black hole variant is described with two symmetries and related gauge couplings, along with a single scalar field. The symmetries $\left[X^{\mu}\right]=-1$4 and $\left[X^{\mu}\right]=-1$5 are imposed, which results in two decoupled sectors with related couplings and a canonically normalized scalar field."
182,How does the mapping of electrically charged black hole solutions with two gauge couplings to dyonic black hole solutions with one coupling work in the context discussed in the text?,"The text explains that in the discussed context, where the gauge couplings are inversely related, one can map electrically charged black hole solutions with two symmetries to dyonic black hole solutions with just one symmetry. This mapping allows for the analysis of the solutions in either of these perspectives within the framework presented."
183,What is the significance of maximizing the charge-to-mass ratio in the context of black holes with vanishing gauge coupling?,Maximizing the charge-to-mass ratio in the context of black holes with vanishing gauge coupling is significant because it sheds light on the behavior of such black holes and can lead to insights into their properties and interaction with external fields.
184,How does the proposed bound on the charge-to-mass ratio for black holes with dilatonic couplings compare to the traditional Reissner-Nordstrom case?,The proposed bound on the charge-to-mass ratio for black holes with dilatonic couplings presents a factor of 2 difference from the Reissner-Nordstrom case. This distinction is crucial in understanding the behavior and constraints placed on such black holes in different theoretical frameworks.
185,"In the context of the Weak Gravity Conjecture, how does the dependency of the gauge coupling on the dimensions impact the mass of the conjectured particle?","In the Weak Gravity Conjecture, the dependency of the gauge coupling on the dimensions plays a role in determining the mass of the conjectured particle. Specifically, the mass of the Weak Gravity Conjecture particle is expected to depend on the dimensions exponentially, with an exponent that is at least as large as the gauge coupling. This relationship highlights the intricate connection between fundamental properties of particles and the dimensional nature of the underlying theory."
186,What is the significance of the mass bound given by equation (wgcsc) for charged states in the theory with charge $X^{\mu}$1?,The mass bound represented by equation (wgcsc) for charged states with charge $X^{\mu}$1 implies that the mass of the states must be greater than or equal to the absolute value of the function $Z(q)$. This bound is crucial in understanding the properties of BPS states and plays a role in the Weak Gravity Conjecture.
187,Why do BPS states satisfy the bound while non-BPS states may also satisfy the Weak Gravity Conjecture?,"BPS states are known to saturate the bound imposed by the Weak Gravity Conjecture, ensuring that their mass is at least as large as the absolute value of $Z(q)$. On the other hand, non-BPS states have the flexibility to meet the requirements of the Weak Gravity Conjecture without needing to strictly adhere to the saturation condition as observed in BPS states."
188,How do black holes fit into the discussion of BPS states and their discharge potential?,"In the context of BPS states, black holes can themselves be considered as BPS states. BPS black holes in $X^{\mu}$2 supergravity are automatically extremal, although not all extremal black holes are necessarily BPS. It is understood that BPS states charged under multiple $X^{\mu}$3s with co-prime charges can decay only to other BPS states over certain regions of moduli space known as curves of marginal stability. The discharge of BPS black holes is closely tied to their stability and interactions with other BPS states."
189,What is the significance of meta-stable bound states in the context of the scalar force described in the text?,"In the context of the text, meta-stable bound states are those bound states that are stable for a finite period of time in terms of quantum mechanics, but are not permanently stable. The significance of these states lies in understanding the behavior and potential outcomes of interacting scalar particles, which can provide insights into the overall behavior of the system and the stability of such bound states."
190,"How does the presence of scalar fields affect the Weak Gravity Conjecture, as discussed in the text?","The presence of scalar fields introduces a new term in the Weak Gravity Conjecture, altering the balance between the scalar force and the gauge force in the system. Specifically, the additional term modifies the constraints defined by the Weak Gravity Conjecture, which in turn impacts the overall dynamics and behavior of the system involving scalar particles and their interactions."
191,"Can you elaborate on the implications of the limit where the scalar force term cancels the gauge force term, as mentioned in the text?","The limit where the scalar force term exactly cancels the gauge force term is a scenario of particular interest as it signifies a delicate balance between these two fundamental interactions. In this context, the physics of this limit can provide valuable insights into the nature of the forces involved, their relative strengths, and the potential consequences of such cancellations on the overall dynamics and stability of the system containing both scalar and gauge fields."
192,"What is the significance of the limit discussed in the text, where the mass becomes small but the ultraviolet cutoff scale remains high in the context of the effective theory?","The limit discussed in the text is significant because it implies a scenario where a particle's mass becomes small while keeping the ultraviolet cutoff scale high in the effective theory. This suggests a form of ultraviolet-infrared (UV/IR) mixing, where quantum gravity physics demands a particle much lighter than the cutoff scale. This is interesting as it could have implications for understanding the interplay between quantum gravity effects and the mass scale of particles."
193,How does the condition $\beta^2 M_p^2 \geq m^2$ in Equation (\ref{simineq}) relate to the properties of the theory being discussed?,The condition $\beta^2 M_p^2 \geq m^2$ in Equation (\ref{simineq}) is crucial as it sets a constraint on the parameters of the theory being discussed. It ensures that the theory remains consistent and relevant within the specified framework. This inequality is fundamental for understanding the interplay between the parameters governing the mass term and the Planck scale in the theory.
194,In what way does the existence of a hierarchy being technically natural when $\sqrt{-\mathrm{det}\;h} \rightarrow e^{2 Lambda\left(\xi\right)} \sqrt{-\mathrm{det}\;h}$ relate to the broader implications of the theory?,"The natural emergence of a hierarchy when $\sqrt{-\mathrm{det}\;h} \rightarrow e^{2 Lambda\left(\xi\right)} \sqrt{-\mathrm{det}\;h}$ holds broader implications for the theory being discussed. It suggests that the theory can naturally accommodate a hierarchy in mass scales without the need for fine-tuning, which aligns with the concept of technical naturalness. This feature can have implications for the predictivity and elegance of the theory, offering insights into the underlying structure and dynamics of the system under consideration."
195,What is the significance of the limit $\sqrt{-\mathrm{det}\;h} \rightarrow e^{2 \Lambda(\xi)} \sqrt{-\mathrm{det}\;h}$ in the context of the Weak Gravity Conjecture and the hierarchy problem?,The limit $\sqrt{-\mathrm{det}\;h} \rightarrow e^{2 \Lambda(\xi)} \sqrt{-\mathrm{det}\;h}$ discussed in the text is significant because it suggests that loop corrections from high mass sectors may not destabilize the hierarchy of scales between particle masses and the cutoff scale of the theory. This observation challenges the conventional ideas of naturalness and implies that the ultraviolet completion of the theory may be more constrained than previously thought.
196,How does the Weak Gravity Conjecture provide insight into the hierarchy problem and the misleading nature of technical naturalness assumptions?,"The Weak Gravity Conjecture contributes to understanding the hierarchy problem by proposing that assumptions of technical naturalness may be misleading. Specifically, it suggests that the ultraviolet completion of the theory might be constrained in such a way that it preserves the hierarchy of scales. By implying that the ultraviolet physics does not disturb the hierarchy, the Weak Gravity Conjecture challenges prevalent notions of naturalness in theoretical physics."
197,"What are the main challenges in realizing scenarios that adhere to the constraints set by the Weak Gravity Conjecture and the hierarchy problem, particularly concerning the physics of scalar fields?","One of the main challenges in realizing scenarios consistent with the Weak Gravity Conjecture and hierarchy problem constraints is understanding the physics of scalar fields, specifically the scalar $h_{ab}$. Ensuring that the inequality holds true when $h_{ab}$ is precisely massless presents a difficulty, but it is suggested that modifications could accommodate small masses. Additionally, investigating the possibility of an obstruction to certain limits while keeping other parameters finite, as seen in supergravity theories like $h_{ab}$ supergravity, poses another challenge in scenarios without supersymmetry."
198,What is the significance of the conifold locus in string theory when considering the Weak Gravity Conjecture (wgcsc) and naturalness?,"The conifold locus in string theory provides explicit examples where certain limits are possible, leading to discussions around the Weak Gravity Conjecture and naturalness in theoretical physics. Understanding the behavior of theories at this special locus can shed light on the compatibility of fundamental principles like the wgcsc with our understanding of naturalness in the context of supergravity and string theory."
199,How does the Scalar Weak Gravity Conjecture (SWGC) extend the original Weak Gravity Conjecture (wgcsc) to incorporate scalar forces in particle theories?,"The Scalar Weak Gravity Conjecture (SWGC) is an extension of the original Weak Gravity Conjecture (wgcsc) that considers the relative strength of gravitational forces with respect to scalar forces in a theory. It posits that even in the presence of scalar forces, gravity should remain the weakest force acting on at least one particle in the theory. The SWGC provides additional constraints on theories with scalar fields, ensuring consistency with fundamental principles of gravitational interactions."
200,How does the bound defined in the Scalar Weak Gravity Conjecture (SWGC) relate to the presence of massless scalar fields and supersymmetry?,"The bound specified in the Scalar Weak Gravity Conjecture (SWGC) is a strict inequality that relates the mass of a state in a theory with massless scalar fields to the Planck mass and the derivatives of the scalar field. The connection to supersymmetry arises because certain aspects of the SWGC are naturally motivated by considerations within supersymmetric theories. The presence of massless scalar fields and their implications for gravitational interactions, as discussed in the SWGC, provide insights into the interplay between scalar forces, gravity, and fundamental symmetries in theoretical physics."
201,"What is the relationship between massless scalar fields, supersymmetry, and the Weak Gravity Conjecture (WGC) as discussed in the text?","The text discusses how the presence of massless scalar fields is naturally tied to supersymmetry and the Weak Gravity Conjecture (WGC). Specifically, it mentions that the (WGC) is satisfied by BPS states, and there is at least one BPS state for every scalar field in a vector multiplet that satisfies the (WGC). It also delves into two versions of the (WGC) proposed in the cited work and the motivations behind them."
202,How does the concept of repulsive interactions between different states mediated by scalar fields influence the discussion around the Weak Gravity Conjecture?,"The text acknowledges that while a scalar always mediates an attractive interaction as a self-force, interactions between different states mediated by scalar fields can be repulsive. This idea of repulsive interactions plays a role in the arguments supporting a milder version of the Weak Gravity Conjecture (WGC) that specifically involves the Weak Gravity Conjecture particle, which is also charged under a $D$0 symmetry."
203,How does the Weak Gravity Conjecture tie in with the Swampland Distance Conjecture as mentioned in the text?,"The text suggests that the Weak Gravity Conjecture (WGC) also relates to the Swampland Distance Conjecture. It hints at a discussion to be presented in more detail in a specific section of the text. The connection between the two conjectures implies that understanding one concept may shed light on the other, potentially deepening our insights into fundamental principles in theoretical physics."
204,What is the relationship between the Scalar Weak Gravity Conjecture and large distances in field space?,"The text mentions that the scalar state should couple to may be extended in nature at large distances in field space, and the relation of the Scalar Weak Gravity Conjecture holds most straightforwardly at these large distances, indicating a specific behavior of scalar fields and their gravitational interactions."
205,How does dimensional reduction affect the Scalar Weak Gravity Conjecture?,"The text refers to a study that discusses the behavior of the Scalar Weak Gravity Conjecture under dimensional reduction. It suggests that the limit where the left-hand side of the conjecture tends to zero might be linked to a lowered cutoff scale, implying a connection between dimensional reduction and the constraints imposed by the Scalar Weak Gravity Conjecture."
206,What was proposed in the version of the Scalar Weak Gravity Conjecture involving the second derivative of mass?,"The text mentions a proposal in a version of the Scalar Weak Gravity Conjecture that involves the second derivative of the mass. This proposal introduces constraints on the scalar itself and its potential, indicating a deeper understanding of the gravitational interactions of scalar fields and their implications for fundamental physics."
207,What is the Weak Gravity Conjecture and how do towers of charged states relate to it in theoretical physics?,"The Weak Gravity Conjecture is a hypothesis in theoretical physics proposing that for any given gauge theory coupled to gravity, there should exist towers of charged states with increasing charges and masses. These states are required to satisfy certain conditions to prevent the breakdown of the theory. The existence of these towers is crucial to maintain the consistency and stability of the theory, as they provide a mechanism to counterbalance the effects of gravity."
208,How do the different proposals for towers of states vary in their properties and implications for the Weak Gravity Conjecture?,"Various proposals have been put forward regarding the nature of towers of states and their relationship to the Weak Gravity Conjecture. These proposals differ in their specific characteristics, such as the structure of the tower and the constraints imposed on the masses of the states based on their charges. Understanding these differences is essential in evaluating the validity and implications of the Weak Gravity Conjecture in different theoretical frameworks."
209,What role do discrete symmetries and sub-lattice structures play in refining the Weak Gravity Conjecture and the proposals for towers of states?,"Discrete symmetries and sub-lattice structures are critical elements in refining the Weak Gravity Conjecture and the corresponding proposals for towers of states. These features help to establish more specific constraints on the masses and charges of the states within the towers, leading to a more nuanced understanding of how the Weak Gravity Conjecture operates in the context of different theoretical models. By incorporating these symmetries and structures, researchers can refine and improve the predictions and implications of the conjecture in diverse physical scenarios."
210,How do the Kaluza-Klein modes play a role in the spectrum of charged states within this theoretical framework?,"The Kaluza-Klein modes of a particle contribute to the spectrum of charged states by adding charged states that are extremal and lie on the unit circle. These modes generate a dense set of points along an ellipse, with the pure Kaluza-Klein charged states being particularly dense."
211,"In the context of the convex hull of these charged states, what condition must be satisfied for it to contain the unit circle, and how does the radius of the circle come into play?","The convex hull containing the unit circle imposes a bound, which reads as $\left( m_0 R \right)^2 \geq \frac{1}{4z_0^2\left(z_0^2-1\right)}$, where $R$ is the radius of the circle. This condition dictates that for small values of $R$, the bound can be violated unless there exists a tower of charged states in the higher dimensional theory."
212,How does the presence of a tower of charged states in the original higher dimensional theory impact the spectrum of charged states and the convex hull formation?,"Introducing a tower of charged states in the higher dimensional theory results in a spectrum of charged states that densely populate the ellipse. This tower of states forms an infinitely dense set of points along the ellipse, allowing the convex hull to contain the unit circle for any value of the charge. The presence of this tower is crucial to avoid violating the bound on the convex hull for small radii values."
213,What is the significance of the canonical pairing induced by integrating a $D$1-form over the world-volume of a $D$0 dimensional object?,The canonical pairing induced by integrating a $D$1-form over the world-volume of a $D$0 dimensional object signifies how a $D$9-form field naturally couples to the $D$0 dimensional object. This integration captures the interaction between the higher-dimensional field and the lower-dimensional object through a pairing mechanism.
214,How are the magnetic dual fields of each form field related and obtained in the context described in the text?,"In the context presented, each form field has a magnetic dual field that offers an alternative description of the same physics. To obtain the type of the dual field, one can apply the Hodge star operation or contract with the Levi-Civita tensor in tensor form on the field strengths. The dual field is essentially the variation of the action with respect to the original field. For example, the magnetic dual field of a $D$7 4-form field is a scalar dual field strength, highlighting the non-dynamical nature of certain form fields."
