,Question,Answer
86,How does the inclusion of Kaluza-Klein (KK) modes within the $R^d$-dimensional theory relate to the universal quantum gravity bound and the effective theory's scale?,"Including the KK modes within the $R^d$-dimensional theory allows for a quantitative analysis of how many modes can be accommodated before reaching the universal quantum gravity bound, which is the $R^d$-dimensional Planck mass. This counting of KK modes provides insights into the effective description of higher-dimensional theories and helps ascertain the consistency and limitations of the effective field theory approach within the framework of string theory."
87,What are some examples of indirect evidence from string theory constructions mentioned in the text?,"Some examples of indirect evidence from string theory constructions mentioned in the text are the consideration of string theory vacua as providing experimental input for proposed theories, and the approach of motivating general properties of quantum gravity that would manifest in the infrared to arrive at Swampland criteria."
88,What distinguishes the direct approach of deriving Swampland criteria from general properties of ultraviolet physics compared to the indirect method discussed in the text?,"The direct approach of deriving Swampland criteria from general properties of ultraviolet physics involves starting from specific characteristics of the ultraviolet physics to derive the Swampland criteria directly. The indirect method, on the other hand, involves assuming certain infrared properties of gravity based on general properties of quantum gravity that would manifest in the infrared, rather than directly working from the ultraviolet physics."
89,"How does the text propose to use the ""signposts"" and conjectures regarding Swampland criteria to build a framework for understanding the Swampland?","The text suggests using the signposts and conjectures as a network of indications towards the type of criteria that could be a part of the Swampland, and how these criteria may be interrelated. By presenting arguments for each proposal or conjecture, the text aims to establish a framework that houses both new and old ideas about the Swampland, generating hypotheses that can be tested within the realm of string theory."
90,What are the fundamental principles that a quantum theory of gravity should manifest in the infrared based on the text provided?,The text mentions that there are proposed principles related to the infrared behavior of quantum gravity. These principles are developed to motivate a rich structure of Swampland criteria. The text indicates that such principles include the absence of global symmetries in quantum gravity and that other criteria may be established based on the underlying microscopic physics.
91,"How can the signposts and arguments discussed in the text aid in uncovering the Swampland criteria, and what role do they play in supporting the proposed principles of a quantum theory of gravity in the infrared?","The text highlights that the signposts and arguments serve as indirect methods to guide researchers towards understanding the Swampland behavior that can be expected. These signposts provide a framework for presenting various proposed criteria and their interrelations. However, it is important to note that these arguments are not proofs but rather indications that may lead to a better comprehension of the Swampland criteria and the principles underlying quantum gravity in the infrared."
92,"How do the Swampland criteria discussed in the text relate to the idea that quantum gravity should have no global symmetries, and what significance does this hold in theoretical physics?",The text suggests that many of the Swampland criteria are aimed at extending the notion that quantum gravity should not exhibit global symmetries. The absence of global symmetries is considered one of the initial Swampland criteria with motivating arguments supporting it. This idea plays a crucial role in theoretical physics as it provides insights into the nature of quantum gravity and how certain principles and criteria can be used to understand the underlying structure of the Swampland.
93,How does holography in anti-de Sitter space help in studying the absence of global symmetries in perturbative string theory?,"Holography in anti-de Sitter space provides a powerful tool to study the absence of global symmetries in perturbative string theory. By utilizing holography, researchers can gain insight into the absence of global symmetries, a recent proof of which was presented in research papers such as \cite{Harlow:2018tng,Harlow:2018jwu}. This approach allows for formulating conjectures like the No Global Symmetries Conjecture."
94,How does the No Hair Theorem relate to the absence of global symmetries in black holes formed in the presence of charged matter?,"The No Hair Theorem plays a significant role in the context of black holes and global symmetries. The theorem states that the metric of a black hole is unique for uncharged stationary black holes. For black holes formed in the presence of charged matter under a putative exact global symmetry, the charge is not reflected in the properties of the black hole horizon. This lack of reflection of charge in the horizon properties becomes more pronounced when considering semiclassical effects like Hawking radiation."
95,How do Euclidean wormholes relate to the understanding of shift symmetries and their implications in the absence of global symmetries?,"Euclidean wormholes are closely related to shift symmetries and play a role in understanding the absence of global symmetries. While black holes are natural objects to study for global symmetries, shift symmetries are more appropriately understood in the context of Euclidean wormholes. Recent reviews such as \cite{Hebecker:2018ofv} shed light on the connection between Euclidean wormholes and shift symmetries, offering further insights into the absence of global symmetries in theoretical physics."
96,How does the phenomenon of Hawking radiation affect the mass and global charge of a black hole in the context of quantum gravity?,"In the context of quantum gravity, Hawking radiation leads to the mass loss of a black hole due to the emission of particles. While the black hole can lose mass through this process, it is unable to shed its global charge because the horizon does not distinguish between positive and negative charges. This results in a fundamental uncertainty regarding the global charge of the black hole, leading to an inconsistency between the infinite uncertainty predicted by quantum gravity and the finite entropy described by Bekenstein-Hawking entropy."
97,Why does the argument presented in the text suggest that quantum gravity should not possess global symmetries?,"The argument revolves around the concept of remnants, which are black holes restricted to their smallest possible mass. In the scenario where a black hole has shed its mass to the Planck scale regime through Hawking radiation, it reaches a point where it lacks the mass necessary to emit enough charged particles to rid itself of its global charge. This stability due to global charge leads to the conclusion that quantum gravity theories should not exhibit global symmetries, as they would prevent the black hole from shedding its charge, resulting in a stable but light object known as a remnant."
98,How does the existence of remnants challenge our understanding of black hole evaporation and the behavior of black holes at quantum scales?,"The concept of remnants challenges traditional views of black hole evaporation by suggesting that a black hole can stabilize at the Planck scale due to its global charge, rather than evaporating completely. This challenges the traditional picture of black holes reaching a final state of evaporation and suggests that there may be a quantum regime beyond the semi-classical description of black hole evaporation, where global charges play a crucial role in the stability of the black hole. Remnants highlight the limitations of our current understanding of black hole behavior at quantum scales and the need for a more comprehensive theory that can address the issue of black hole remnants."
99,How does the notion of black hole entropy help address issues related to global symmetries in theoretical physics?,"The notion of black hole entropy provides a bridge between different regimes in theoretical physics, allowing researchers to bypass certain issues, especially concerning global symmetries. By interpreting entropy through a microstates counting approach, it offers a stronger argument supported by the correlation between the infinities associated with global symmetries. This helps guide researchers towards the Swampland criteria and provides indirect signposts for further investigations."
100,In what ways can gauge symmetries be related to global symmetries in the context of quantum gravity theories?,"While gauge symmetries are inherently compatible with quantum gravity, there are ways to establish relationships between gauge symmetries and global symmetries to constrain properties of theories within quantum gravity frameworks. By connecting gauge symmetries to global symmetries, researchers can explore constraints and motivations for theoretical ideas. For example, considering gauge couplings approaching zero or specific transformations can reveal insights into the interplay between gauge and global symmetries."
101,"How can the concept of de Rham cohomology help distinguish between exact and closed forms in theoretical physics, particularly in the context of different gravitational constants?","The concept of de Rham cohomology provides a mathematical framework to differentiate between exact and closed forms in theoretical physics, specifically with respect to gravitational constants like $G_N$. In the given context, exact forms correspond to one gravitational constant while closed forms correspond to another. While locally there may seem to be no discernible difference, physics sensitive to global spacetime aspects can reveal distinctions, demonstrating the importance of understanding the implications of exactness and closedness in gravitational theories."
102,"What is meant by the statement that physics sensitive to global aspects of space can tell the difference between different transformations locally indistinguishable, such as $M^d_p=18$ and $M^d_p=19$?","The statement that physics sensitive to global aspects of space can distinguish between transformations that are locally indistinguishable refers to how phenomena that extend over the entire space-time manifold can reveal the distinction. In the context of the text, different transformations can have implications on global properties of the space, such as topological features or symmetries that might be observable in non-local effects or through specific physical observables."
103,How does the introduction of charged matter in a theory impact the generalized global symmetry and the gauge covariant derivative?,"The introduction of charged matter in a theory can break the generalized global symmetry. In the context of gauge theories, the gauge covariant derivative for a charged field is not invariant under transformations associated with the generalized global symmetry, but instead transforms under a more restricted subgroup of symmetries, leading to a breaking of the generalized global symmetry. This illustrates how the presence of charged matter can alter the symmetry properties of a theory."
104,"What is the Completeness Conjecture in the context of quantum gravity and gauge theories, and how does it relate to the presence of charged states?","The Completeness Conjecture in the context of quantum gravity and gauge theories asserts that a theory with a gauge symmetry, when coupled to gravity, must possess states of all possible charges consistent with Dirac quantization under the gauge symmetry. This implies that the theory should accommodate all charge sectors allowed by the gauge group. The Conjecture does not specify the masses of these charged states; they may be very heavy, possibly around the Planck mass. The presence of these charged states ensures that the theory is complete and consistent in incorporating all possible gauge charges."
105,How does the concept of generalized global symmetries relate to the presence of charged black holes in theoretical physics?,"The concept of generalized global symmetries is related to the existence of charged objects such as charged black holes. These charged objects break the generalized global symmetry, but for this symmetry to be fully broken, all possible charges must be present. The presence of charged black holes complicates the dynamics of these symmetries within the context of theoretical physics."
106,"In the context of field theory and gravity, how does the treatment of probe particles differ and what implications does this have on the formation of black holes?","In field theory, probe particles can have their mass sent to infinity, effectively decoupling them from the theory. However, in the realm of gravity, this is not possible as a probe particle with infinite mass would eventually collapse into a black hole due to its gravitational interactions. This distinction plays a significant role in understanding the behavior of charged particles and black holes in theoretical physics."
107,"What is the significance of the Weak Gravity Conjecture in relation to global and gauge symmetries, and how does it utilize black hole based arguments to support its claims?","The Weak Gravity Conjecture is a proposal that states that gravity is the weakest force among the fundamental forces of nature. In the context of global and gauge symmetries, this conjecture asserts that charged black holes play a crucial role in understanding the dynamics of these symmetries. By utilizing black hole based arguments, the Weak Gravity Conjecture aims to draw parallels between the behaviors of black holes charged under gauge symmetries and those charged under global symmetries, shedding light on the interconnectedness of these fundamental concepts in theoretical physics."
108,How does a black hole charged under a gauge symmetry differ from one charged under a global symmetry in the context of the Weak Gravity Conjecture in four dimensions?,"A black hole charged under a gauge symmetry interacts with a gauge field that couples to the gravitational field in the theory, while a black hole charged under a global symmetry does not have this direct coupling to the gravitational field. In the context of the Weak Gravity Conjecture, this distinction is important as it affects the inequalities that the charged black holes must satisfy."
109,"What is the significance of the inequalities stated in the Weak Gravity Conjecture in four dimensions, particularly the electric Weak Gravity Conjecture and the magnetic Weak Gravity Conjecture?","The inequalities in the Weak Gravity Conjecture in four dimensions, such as the electric Weak Gravity Conjecture ($m \leq \sqrt{2} g q M_p$) and the magnetic Weak Gravity Conjecture ($\Lambda \lesssim g M_p$), provide constraints on the masses, charges, and cutoff scales of particles or black holes in a theory with gauge symmetry coupled to gravity. These inequalities are crucial as they ensure the consistency of the theory with the principles of quantum gravity."
110,"How do the subtleties in the definition of the Weak Gravity Conjecture, such as the reference to ""particle"" and the ambiguity in fixing the gauge coupling, impact the interpretation and applicability of the conjecture?","The subtleties in the definition of the Weak Gravity Conjecture play a significant role in shaping its interpretation and scope. For instance, the reference to a ""particle"" in the conjecture implies a mass limit below the Planck scale, although it can be extended to heavier states like charged black holes. Moreover, the ambiguity in fixing the gauge coupling arises due to the freedom in rescaling certain parameters, which can affect the precise form of the inequalities in the conjecture. Understanding and addressing these subtleties are crucial for a thorough application of the Weak Gravity Conjecture in theoretical physics."
111,What is the significance of the gauge coupling D9 in the context of the action (4dema)?,"The gauge coupling D9 in the action (4dema) is not fixed solely by the action itself because an arbitrary scaling of the spacetime $\mathbb{R}^{1,D-1}$ can be absorbed into the definition of the gauge field. The normalization of the gauge coupling is implicitly determined by the action, ensuring that the gauge field has a canonical coupling to matter currents."
112,"How is the cutoff scale in the context of (mwgc) related to the mass scale of an infinite tower of states, as mentioned in the text?","The cutoff scale mentioned in (mwgc) is linked to the mass scale of an infinite tower of states. In the context of the Weak Gravity Conjecture, this scale is associated with the energy at which new degrees of freedom become important in the theory, often connected to the presence of high-mass states in the spectrum, as discussed in the text."
113,"Can the presence of a $\mathbb{R}^{1,D-1}$6 gauge symmetry affect properties of black hole solutions, as indicated by the text?","Yes, the presence of a $\mathbb{R}^{1,D-1}$6 gauge symmetry can impact properties of black hole solutions. In the text, the charged black hole solution is described with modifications to the metric function due to the presence of the gauge field, leading to the emergence of two horizons due to the quadratic dependence on the black hole charge."
114,What is the significance of the extremality bound in the context of charged black holes?,"The extremality bound for charged black holes, represented by the inequality $M_{\mathrm{ADM}} \geq \sqrt{2} g Q M_p$, is crucial for understanding the properties of these black holes. When the extremality bound is satisfied, the black hole is called extremal, and it implies that the two horizons of the black hole coincide. Deviating from this bound leads to the formation of a naked singularity."
115,How do the number of possible black holes relate to the extremality bound in the case of different symmetries?,"In the case of global $\mathbb{R}^{1,D-1}$ symmetry, there can be an infinite number of black holes with different charges but the same finite mass. However, for a gauge symmetry with the symmetry $X^0=t$0, the extremality bound dictates there are only a finite number of black holes below a given mass $X^0=t$1. This relationship is quantitatively represented by the equation $N_{\mathrm{BH}} \sim \frac{\Lambda}{g M_p}$."
116,How does the limit $X^0=t$3 affect the measurability of black hole charges and the arguments regarding global symmetries?,"In the limit $X^0=t$3, the number of black holes below a given scale diverges, making it increasingly challenging to measure the black hole charges due to the absence of flux from the black holes at that limit. This poses a challenge to the previous arguments against global symmetries by revealing that measuring the charge of a black hole is not always as straightforward as previously thought, especially when approaching certain limits in the system."
117,"What were the attempts to make the charge uncertainty argument for the magnetic Weak Gravity Conjecture quantitative and rigorous, and why were they considered to have limited success?","The attempts to make the charge uncertainty argument for the magnetic Weak Gravity Conjecture quantitative and rigorous were made in reference to \cite{Saraswat:2016eaz,Schadow}. These attempts had limited success, possibly due to the complexity and challenges in accurately quantifying the charge uncertainty argument within the framework of the magnetic Weak Gravity Conjecture."
118,How is the concept of remnants tied to the violation of entropy bounds in the context of the global symmetry case and the gauge symmetry case?,"In the context of the global symmetry case and the gauge symmetry case, the concept of remnants is tied to the violation of entropy bounds by considering the presence of an infinite number of stable remnants. One approach to address a rigorous problem associated with these remnants is to explore entropy bounds violations, as discussed in \cite{Banks:2006mm}."
119,How does the concept of black hole remnants being treated as fundamental particles in their own right relate to theories with different species of particles and the Covariant Entropy Bound?,"The concept of treating black hole remnants as fundamental particles in their own right, such as by running them in loops as particles, allows for a theoretical exploration related to theories with different species of particles. This exploration can be connected to the Covariant Entropy Bound, as seen in the relationship between species of particles and black hole remnants described by the formula $N_s=\frac{1}{g}$, showcasing a link between fundamental particle behavior and entropy bounds in theoretical physics."
120,How does the Covariant Entropy Bound (CEB) relate to the principle of holography and what is its specific formulation in flat spacetime?,"The Covariant Entropy Bound is a way to formally express the holographic principle in the context of quantum gravity. In flat spacetime, the CEB states that the entropy inside a box or sphere of a given radius should not exceed a quarter of the area of that surface, i.e., S  A(R)/4."
121,"What is the relationship between the Covariant Entropy Bound and the Bekenstein Bound, and how do they differ in their formulations and consequences?","The Covariant Entropy Bound is closely related to the Bekenstein Bound, which imposes an upper limit on the entropy of matter inside a sphere based on its mass-energy and radius. While the Bekenstein Bound does not involve the area, the CEB directly ties entropy to the surface area. This difference allows the CEB to maintain its validity even in quantum field theory limits, unlike the Bekenstein Bound."
122,"How does the Species Problem challenge the entropy bounds, particularly in the scenario of multiple non-interacting particle species, and what were the findings regarding these challenges in previous studies?","The Species Problem arises when considering multiple non-interacting particle species and questions the validity of entropy bounds when the number of species is large. It was thought that for a sufficiently high number of particle species, the entropy would grow beyond the bounds. However, studies such as the one by Casini et al. (2008) showed that the entropy bounds, especially the Bekenstein Bound, are not violated even in the limit of a large number of particle species. This result was built upon earlier works by Marolf and others, indicating the robustness of the entropy bounds in such scenarios."
123,How does the saturation of the bound for the parameter $\gamma$6 influence the species scale in terms of the Hubble scale and minimum energy excitation in a sphere?,"The saturation of the bound for the parameter $\gamma$6 results in the species scale being inversely proportional to the square root of the number of species ($N_s$), and consequently to the radius of the sphere ($R$). This relationship is characterized in Equation \ref{spceb} where the species scale $\Lambda_s \sim \frac{1}{\sqrt{N_s}} \sim \frac{1}{R}$, representing the Hubble scale of the sphere and setting the minimum energy excitation within the sphere."
124,How do considerations about the species scale impact the potential violation of entropy bounds with respect to black hole remnants and the effective theory cutoff?,"When analyzing the implications of a large number of remnants or species in the context of black hole remnants, it is crucial to recognize that an increased number of remnants could lead to a lower cutoff for any effective theory, as determined by the species scale. If the parameter $\gamma$7 is raised beyond a certain point $\gamma$8, the species cutoff could fall below the zero-point energies of the fields. Therefore, the species scale plays a critical role in censoring the increase of $\gamma$ and maintaining consistency with entropy bounds."
125,"How do the Weak Gravity Conjectures, specifically the magnetic and electric versions (mwgc and ewgc), intersect with considerations of charge discharging in black hole physics?","The Weak Gravity Conjectures, both magnetic and electric versions, are interconnected with black hole physics, particularly concerning charge discharging processes. The electric Weak Gravity Conjecture (ewgc) stipulates that all black holes must be able to discharge themselves, ensuring that there is a mechanism for the removal of charge from the black hole horizon. This requirement is vital for scenarios involving global or gauge symmetries, where the ability of black holes to emit charged particles, akin to Hawking radiation, is contingent upon the existence of mechanisms for charge discharge."
126,How does the gauge symmetry of a black hole relate to the discharge processes involving charged particles emitted from the black hole?,"The gauge symmetry of a black hole induces a field around its horizon, allowing for discharge processes similar to Hawking radiation, where charged particles are emitted. The dominance of either discharge process depends on factors such as the mass and charge of the black hole, the mass and charge of the emitted particle, and the normalized gauge coupling."
