,Question,Answer
44,"What are the cosmological implications of the tachyon field that independent of brane inflation, as mentioned in the text?","The tachyon field has potential cosmological implications beyond brane inflation. String calculations suggest that the actions involving the tachyon take a Born-Infeld form to all orders in derivative expansion, and the resulting gas from the rolling of the tachyon corresponds to a pressure-less gas."
45,"What are the implications of the time-dependent tachyon field on the energy density and pressure, as described in the text?","The time-dependent tachyon field described in the text leads to implications on the energy density and pressure of the system. The relationship between the energy density $\rho$ and pressure $p$ is given by $\rho = \frac{V(t)}{\sqrt{1-\dot{T}^2}}$ and $p = -V(T)\sqrt{1-\dot{T}^2}$. For constant energy density, the pressure varies as the space dimension according to $D=d+1$. The equation of state and the relation $\ell_s = 1$ are also detailed."
46,"How does the time-dependent tachyon field affect the evolution of the universe, specifically in terms of expansion, acceleration, and potential outcomes like a Milne universe or re-collapse?","The text describes the impact of the time-dependent tachyon field on the evolution of the universe. The equations derived, such as Friedmann's equations, show that the energy density decreases with time while the string length scale $\ell_s$ increases, leading to the universe's expansion. The behavior involves phases of acceleration and deceleration, with potential outcomes of reaching a constant scale factor, becoming a Milne universe, or re-collapsing, influenced by spatial curvature parameters."
47,"Can the tachyonic potential associated with the time-dependent tachyon field alone lead to inflation, and what are the challenges in achieving this?","The text mentions the possibility of the tachyonic potential from the time-dependent tachyon field causing inflation by itself. However, it highlights the challenge in achieving inflation solely through this potential due to the absence of small parameters that can be adjusted to induce a slow roll. This limitation is elaborated based on the nature of the potential, indicating complexities in tuning parameters for inflation. The references provided further discuss related aspects in exploring this potential scenario."
48,How do the dynamics of closed string tachyons differ from open string tachyons in terms of their effects on spacetime?,"Closed string tachyons differ from open string tachyons in that their condensation may represent the disappearance of spacetime itself, as they are intrinsically gravitational. While open string tachyons trigger the disappearance of D-branes by settling to the potential minimum, closed string tachyons are more intricate and can lead to the disappearance of spacetime in a more complex manner."
49,Why is the study of closed string tachyons more challenging compared to open string tachyons in the context of string field theory?,"Closed string tachyons pose a greater challenge in string field theory compared to open string tachyons because the understanding of their dynamics and implications is not as advanced. String field theory has made more progress in studying open strings, leading to a better understanding in that context. The complexities of closed string tachyons, especially in relation to spacetime disappearance, make them a more challenging subject of study."
50,"Can you elaborate on the concept of S-brane and its significance in theoretical physics, especially regarding the dynamics of potential fields like the double-well form?","S-branes are topological defects where all longitudinal dimensions are spacelike, existing only for an instant of time. In theoretical physics, S-branes are introduced for various reasons. In the context of field theory, they correspond to time-dependent configurations of potential fields like the double-well form. The dynamics of S-branes involve starting at the potential maximum with nonzero velocity, rolling towards the minimum, and oscillating before reaching the final stable state. These transient properties make S-branes interesting objects to study in relation to field dynamics and spacetime structures."
51,How does the described process of time reversal and field evolution relate to the formation of an S2 brane in theoretical physics?,"The process of time reversal and field evolution described in the text leads to the formation of an S2 brane in theoretical physics by involving the field starting at a certain temperature (β=1/T07) and evolving to another temperature (β=1/T08), creating a kink in time and filling all spatial dimensions. This formation of an S2 brane requires a fine-tuned exchange of energy to allow the field to climb the barrier."
52,"In the context of Einstein's equations coupled to dilaton and antisymmetric tensor fields, how are Sβ=1/T14-branes expected to be found as explicit solutions?","In the context of Einstein's equations coupled to dilaton and antisymmetric tensor fields, like Dβ=1/T13-brane solutions, Sβ=1/T14-brane solutions are expected to be found as explicit solutions. The Lagrangian presented in the text governs the dynamics of the system and the solutions of the equations of motion for these branes resemble the ones found for black branes. S-brane solutions correspond to time-dependent backgrounds, suggesting they may have a cosmological interpretation."
53,How does the described analytic continuation from the Schwarzschild solution to a time-dependent metric relate to the nature of S-branes?,"The described analytic continuation from the Schwarzschild solution to a time-dependent metric illustrates a transformation that characterizes the nature of S-branes. By performing the analytic continuation where certain coordinates are switched to imaginary values and with an additional transformation, the resulting metric represents a time-dependent background in which the surface of constant time and space is a hyperbolic plane rather than a two-sphere. This change in geometry aligns with the time-like nature of S-branes, indicating the significance of time-dependent backgrounds in understanding these theoretical constructs in physics."
54,How do the metrics described in the text relate to the concept of an S-brane in theoretical physics?,"The metrics presented in the text describe the geometries associated with S-brane solutions in theoretical physics. These metrics depict how spacetime is warped and structured around S-branes, showcasing their time-like nature, spacelike Killing vector, and the presence of singularities which act as horizons or physical objects that can carry mass, tension, and charge."
55,"What significance do the singularities in the metrics hold in the context of S-brane solutions, especially in terms of mass, tension, and charge assignment?","In the context of S-brane solutions, the singularities in the metrics are crucial as they represent physical objects to which mass, tension, and charge can be assigned unambiguously. These singularities correspond to negative tension objects, such as end-of-the-world branes with opposite charge. By identifying and analyzing these singularities, researchers can understand the properties and characteristics of S-branes more comprehensively."
56,"How does the concept of S-branes relate to cosmological interpretations such as particle production, Hawking temperature, entropy, and periods of contraction followed by expansion in the universe?","S-branes are not only significant for their gravitational implications but also for their cosmological interpretations. These interpretations include the prediction of particle production due to similarities with black hole geometry, the computation of a generalized Hawking temperature and entropy which may have interesting cosmological meanings, and the natural occurrence of periods of contraction and expansion in the universe as depicted in the Penrose diagram sectors III and I, respectively."
57,How do misaligned supersymmetry and the scale of its breaking impact the fundamental level of supersymmetry?,"Misaligned supersymmetry refers to a scenario where the breaking of supersymmetry occurs in a manner that is non-standard, deviating from the usual expectations. The scale at which supersymmetry breaks is crucial in determining the characteristics of the theory. Misaligned supersymmetry, along with the uncertainty in the breaking scale, can have profound implications on the behavior of supersymmetric theories at the fundamental level."
58,Why is the existence of only 6 or 7 extra dimensions considered significant in certain theoretical scenarios?,"The presence of extra dimensions beyond the familiar three spatial dimensions and one time dimension is a common feature in several theoretical frameworks, especially in theories like string theory. The specific number of extra dimensions, such as 6 or 7 as mentioned in the text, is often constrained by the requirements of consistency and mathematical elegance within these theories. The existence of a limited number of extra dimensions can lead to unique physical implications and is a focus of research in theoretical physics."
59,How do swampland conjectures in string theory contribute to addressing concrete questions and refining our understanding of effective field theories?,"Swampland conjectures represent a recent approach in string theory aimed at deriving general principles from the vast landscape of string vacua. By extracting concrete conjectures that can be tested through further exploration of string solutions, researchers aim to distinguish between effective field theories that are viable at low energies but fail to be consistent within a more fundamental framework including gravity. This investigative strategy provides a systematic way to evaluate and potentially eliminate theories that are not realizable in the ultraviolet completion of the theory, thereby refining our understanding of the landscape of fundamental physics."
60,What are the implications of the revised distance conjecture for massless scalar fields moving along geodesic trajectories?,"The revised distance conjecture implies that for massless scalar fields moving along geodesic trajectories, as the distance in field space increases, infinite towers of modes with decreasing mass become significant and can no longer be neglected in the Effective Field Theory (EFT). This has implications for field range in single field inflationary models and may affect non-geodesicity in multifield models."
61,How do the swampland conjectures for non-supersymmetric AdS constructions connect to the weak gravity conjecture?,The swampland conjectures for non-supersymmetric AdS constructions are connected to the weak gravity conjecture through an extension that relies on the saturation of the equality between electric and gravitational forces. This extension states that this equality is only achieved when the theory is supersymmetric and the states under consideration are BPS with respect to the supersymmetry. Such a connection implies that non-supersymmetric AdS solutions supported by flux are unstable due to the possibility of decay by a brane nucleation process.
62,"Can backgrounds with spacetime varying scalars allow for trans-Planckian motion without encountering exponentially falling towers of states, and how does this relate to the revised distance conjecture?","Yes, backgrounds with spacetime varying scalars can indeed lead to trans-Planckian motion without the presence of exponentially falling towers of states, as shown in specific cases. This occurrence raises questions about the validity and scope of the revised distance conjecture, indicating that there may be scenarios where the behavior of fields deviates from the predictions of the conjecture. Further investigation is necessary to fully understand the interplay between spacetime varying scalars, trans-Planckian motion, and the implications for the EFT predictions based on the revised distance conjecture."
63,What is the significance of the Dine-Seiberg problem in terms of the behavior of the scalar potential for the volume of extra dimensions and the dilaton?,"The Dine-Seiberg problem highlights that the scalar potential exhibits runaway behavior for both the volume of extra dimensions and the dilaton. This implies that in certain regimes with full control over perturbative expansions, the system enters an asymptotic runaway region where de Sitter vacua at finite volume or non-zero string coupling may not be reliable due to the limitations of the approximations used."
64,How does the bold conjecture regarding the absence of de Sitter vacua in a consistent theory of gravity challenge existing notions in the field?,"The bold conjecture postulates that there might not be any de Sitter vacua in a consistent theory of gravity, suggesting that previously identified de Sitter vacua in the literature could be artifacts of approximations that are not fully reliable. This challenges the conventional understanding and raises questions about the trustworthiness of existing de Sitter solutions within the framework of gravity theories."
65,"How was the original conjecture concerning the Higgs potential challenged and refined, and what additional conditions were proposed to address the limitations?","The original conjecture, which involved a constraint on the gradient of the potential, was found to be violated by the Higgs potential due to certain conditions (such as reaching the maximum limit). Subsequently, a refined version of the conjecture was introduced, incorporating an additional criterion related to the Hessian of the potential. This refinement aimed to address the shortcomings of the original conjecture and offer a more comprehensive approach to analyzing the behavior of the scalar potential in different scenarios within the theory."
66,"What is the Planckian censorship conjecture, and how does it connect to the validity of effective field theories (EFTs)?","The Planckian censorship conjecture posits that in a consistent theory of gravity, there should not be a transfer of modes from the ultraviolet (UV) to the infrared (IR) that would violate the EFT framework. It suggests that certain processes, such as the redshifting of microscopic modes to macroscopic scales below the Planck length, should not occur. This conjecture is significant as it sets constraints on the number of e-folds of inflation and raises questions about the behavior of modes in regimes beyond the EFT's validity."
67,How does the Planckian censorship conjecture impact the study of de Sitter vacua in string theory?,The Planckian censorship conjecture plays a role in the study of de Sitter vacua in string theory by influencing the understanding of the UV to IR mode transfers and constraints on the EFTs in those scenarios. It prompts researchers to investigate the implications of the conjecture on the existence and stability of de Sitter vacua and to explore ways to reconcile this conjecture with cosmological models based on string theory.
68,What are some of the key criticisms or challenges faced by the swampland approach and the Planckian censorship conjecture in particular?,"Some criticisms and challenges faced by the swampland approach, including the Planckian censorship conjecture, involve the speculative nature of these concepts and the lack of a clear explanatory framework for certain restrictions they propose. Critics have raised questions about the relevance of constraints on EFTs imposed by such conjectures and the need for further empirical and theoretical justifications to validate their implications. Additionally, the swampland approach has been perceived as less motivated compared to other conjectures in the field, leading to debates about its significance and impact on advancing our understanding of quantum gravity and cosmology."
69,What are some potential implications of confirming or refining the conjectures in string cosmology on the field of theoretical physics?,"Confirming or refining conjectures in string cosmology may lead to advancements in the field of theoretical physics, particularly in understanding the cosmological implications of consistent theories of quantum gravity. This could provide insights into fundamental questions about the nature of the universe and contribute to the development of more comprehensive models of the cosmos."
70,"How does the concept of ""nothingness"" in theoretical physics relate to the study of gravity?","The concept of ""nothingness"" in theoretical physics plays a crucial role in understanding gravity and the origins of the universe. Physicists have grappled with defining nothingness within the context of physical theories, with proposals ranging from the absence of space, time, and matter. Exploring these ideas can shed light on fundamental questions such as why there is something rather than nothing, ultimately influencing our understanding of gravity and cosmology."
71,Can you elaborate on the significance of Witten's bubble of nothing (BON) and its implications for spacetime evolution?,"Witten's bubble of nothing (BON) is a significant concept in theoretical physics as it offers a concrete example of a transition in spacetime geometry. The BON illustrates a transition from a flat spacetime with a circular fifth dimension to a spacetime where the fifth dimension collapses, resembling a bubble of nothing. This concept highlights the dynamical nature of spacetime and the potential for the evolution of cosmic structures. By showing the expansion of the bubble at the speed of light post-nucleation, Witten's BON provides insights into how spacetime can evolve rapidly under certain conditions."
72,What is the significance of the bubble of nothing scenarios in string compactifications and their potential implications for the stability of the universe?,"The bubble of nothing scenarios in string compactifications refer to the possibility of transitions where bubbles with vanishing size nucleate and expand, effectively consuming spacetime. These bubbles may represent sources of instabilities in the universe. The decay rate of these bubbles may be suppressed due to them being non-perturbative, but their existence raises questions about the stability of the vacuum and the universe as a whole."
73,"How do the different boundary conditions, such as those proposed by Hartle-Hawking and Vilenkin, affect the transition from a state of 'nothing' to a de Sitter space?","The transition from a state of 'nothing' to a de Sitter space is influenced by the choice of boundary conditions. For example, the Hartle-Hawking boundary conditions consider a nucleated universe as a superposition of expanding and contracting ones. On the other hand, the Vilenkin or tunneling transition assumes boundary conditions that only lead to an expanding universe. These different boundary conditions result in distinct probabilities for transitions and affect the dynamics of the universe's evolution."
74,"In the context of the Hartle-Hawking wave function and the Vilenkin normalisation, how do the preferences for cosmological constant values impact the likelihood of inflationary scenarios in the early universe?","The Hartle-Hawking wave function tends to favor smaller values of the cosmological constant, making it challenging to support inflationary models that require a significant cosmological constant. On the contrary, the Vilenkin normalisation leans towards larger values of the cosmological constant, which align better with inflationary scenarios. Therefore, the preferences of these wave functions regarding the cosmological constant values can significantly impact the justification and likelihood of inflation in the early universe."
75,What are the main differences between the Hartle-Hawking and Vilenkin wave functions in terms of their preferences for the cosmological constant values?,"The Hartle-Hawking wave function favors smaller values of the cosmological constant, while the Vilenkin wave function prefers larger values. This preference can make it challenging to justify inflation based on the Hartle-Hawking wave function but easier with the Vilenkin wave function."
76,"How does the approach of transition to a full spacetime, as discussed in this text, differ from the Coleman-de Luccia (CDL) transitions?","In the approach discussed in the text, transitions to a full spacetime occur without bubble nucleation, which is different from CDL transitions that involve bubble nucleation. Additionally, the transitions here lead to closed universes for de Sitter slicing with finite volume, contrasting with CDL transitions that typically give rise to open universes."
77,What implications could the ability to create closed universes from nothing have on understanding the string landscape and the curvature of the universe?,"The ability to create closed universes from nothing could have significant implications for understanding the string landscape. It challenges claims that the string landscape mainly predicts open universes and could provide an alternative mechanism for universe creation. This ability to create closed universes may help differentiate between different mechanisms and the curvature of the universe, potentially impacting our understanding of the landscape and the universe's overall characteristics."
78,What is the main theoretical development in string theory over the past 25 years referenced in the text?,The main theoretical development in string theory over the past 25 years referenced in the text is holography. This concept posits that a gravitational theory in a certain number of dimensions is equivalent to a non-gravitational theory in a different number of dimensions.
79,How does the AdS/CFT correspondence relate to the issue of Hawking's black hole loss of information puzzle mentioned in the text?,"The AdS/CFT correspondence provides a framework that addresses Hawking's black hole loss of information puzzle by indicating that information cannot be lost within the gravitational system, which is echoed by the standard quantum system on the boundary of AdS according to holography."
80,"How has holography been recently utilized to study black holes and their entanglement entropy, specifically with regard to the Page curve behavior?","Holography has recently been utilized to calculate the entanglement entropy of black holes, demonstrating the expected behavior known as the Page curve, which aligns with the idea that no information is lost within the gravitational system if the holographic equivalence holds true."
81,"How do researchers aim to extend the success of AdS/CFT to cosmological questions, even though our universe is not of the AdS type?","Researchers attempt to extend the success of AdS/CFT to cosmological questions by proposing various approaches. One of these approaches involves considering a simple potential with two minima, where one minimum corresponds to a stable AdS vacuum and the other to a nearby metastable de Sitter (dS) vacuum. This setup allows for extracting information about bubbles of the dS phase from the boundary Conformal Field Theory (CFT) spectrum."
82,"In what ways do researchers explore the relationship between inflationary cosmology and Conformal Field Theory (CFT) duals, specifically regarding density perturbations?","Researchers explore the relationship between inflationary cosmology and CFT duals by making efforts to quantify this relation. They compute density perturbations using a Quantum Field Theory (QFT) dual to inflationary cosmology. By working in the weakly coupled QFT regime, known inflationary results are reproduced in the weak gravity regime, providing an alternative phenomenology to inflation."
83,How do the dS/CFT and dS/dS proposals in theoretical physics relate to the well-established AdS/CFT correspondence?,"The dS/CFT correspondence was proposed following parallels with the well-established AdS/CFT correspondence, motivated by the close connections between de Sitter (dS) and Anti-de Sitter (AdS) spaces. Just like AdS/CFT relates quantum field theories in AdS spacetime to gravitational theories in one higher dimension, the dS/CFT correspondence aims to establish a similar relationship but for de Sitter spacetime. The dS/dS proposals seek to extend this correspondence further within the realm of de Sitter spacetimes."
84,How does the proposed dS/CFT correspondence differ from the well-known AdS/CFT correspondence in theoretical physics?,"The dS/CFT correspondence is proposed to be a correspondence between a conformal field theory on the boundary of de Sitter space and the full 4D gravity theory within de Sitter space, whereas the AdS/CFT correspondence relates a conformal field theory defined on the boundary of Anti-de Sitter space to a gravitational theory living in the interior of AdS space. The key motivation for the dS/CFT proposal is the close connection between de Sitter (dS) and Anti-de Sitter (AdS) spaces."
85,How is time identified with the renormalization group parameter in the dS/CFT context and what implications does this identification have?,"In the dS/CFT framework, time is identified with the renormalization group parameter. This identification suggests that the time evolution between two fixed points under the renormalization group could be associated with early universe inflation and the current acceleration of the universe. The monotonic evolution in time aligns well with the expected c-theorem in 2D field theories and its extension, the a-theorem, in 4D."
