,Question,Answer
0,How does string theory aim to address the earliest moments of the Universe and the limitations of the inflationary universe model?,"String theory, being a candidate for a fundamental theory of Nature, is expected to provide insights into the earliest moments of the Universe and what transpired before inflation. It is believed that string theory could introduce alternative scenarios to the inflationary model and reveal a fundamentally stringy nature of matter in the early universe."
1,What are some of the main areas where string theory and cosmology are anticipated to intersect according to the text?,"The text highlights the big-bang singularity as a major area where string theory and cosmology should intersect. It suggests that the current understanding of string theory lacks the capacity to address the very beginning of the universe, and it speculates on the emergence of a non-perturbative formulation of string theory or quantum gravity to make sense of spacetime before the singularity."
2,Could you elaborate on the challenges and significance of exploring alternative scenarios to the inflationary universe within the framework of string theory?,"Exploring alternative scenarios to inflation within the framework of string theory is crucial for broadening our understanding of the early universe. By delving into these different scenarios, researchers aim to uncover unique insights into the nature of matter at the most primordial stages of the Universe and potentially offer fresh perspectives on the evolution of the cosmos that depart from the standard inflationary paradigm. This exploration can push the boundaries of our knowledge and may lead to significant breakthroughs in both string theory and cosmology."
3,"What is the significance of formulating string theory in time-dependent backgrounds, and how does it relate to the broader context of quantum gravity proposals like inflation?","Formulating string theory in time-dependent backgrounds is crucial for understanding the dynamics of the early universe and addressing fundamental questions in quantum gravity. By studying time-dependent backgrounds within string theory, researchers aim to provide a comprehensive framework that can potentially unify quantum mechanics and general relativity. This endeavor is particularly relevant in the context of inflationary cosmology, where string theory may offer alternative explanations or insights into the mechanisms driving the evolution of the universe."
4,"How do the solutions involving time-dependent backgrounds in string theory relate to the expansion of dimensions, especially the observed four large dimensions?","In exploring solutions with time-dependent backgrounds in string theory, researchers are interested in scenarios where the dimensions of spacetime evolve dynamically. Specifically, they seek solutions where the four familiar large dimensions of spacetime expand while the extra dimensions either remain static or expand at a much slower rate. This asymmetry in expansion rates is important for reconciling the observed four-dimensional universe with the higher-dimensional frameworks predicted by theories like string theory."
5,"What are the key components of the low-energy string effective action, and how do they contribute to the implications for cosmology in time-dependent backgrounds?","The low-energy string effective action contains fundamental fields like the metric $g_{MN}$, the dilaton $\varphi$, and the NS-NS (Neveu-Schwarz - Ramond) antisymmetric tensor $B_{MN}$. These fields play essential roles in describing the dynamics of strings and their interactions. In time-dependent backgrounds, the evolution of these fields affects the overall geometry and curvature of spacetime, influencing cosmological outcomes. By studying the behavior of the metric, dilaton, and antisymmetric tensors in time-dependent scenarios, researchers can explore the cosmological implications of string theory and its potential to address fundamental questions in physics."
6,"What are the general classes of cosmological solutions discussed in the text, and what specific references are mentioned for these discussions?","The text mentions recent discussions of general classes of cosmological solutions in references \cite{Hohm:2019jgu, Russo:2022pgo}."
7,Can you explain the Brandenberger-Vafa scenario and its connection to T-duality in string theory mentioned in the text?,The Brandenberger-Vafa scenario is one of the first approaches to string cosmology and is based on the simplest manifestation of T-duality in toroidal compactifications. The scenario explores the implications of T-duality in cosmology by considering the exchange of winding and momentum modes with a self-dual radius.
8,"How does the spectrum discussed in the text relate to T-duality, and what implications does this have for the concept of distance in cosmology?","The spectrum discussed in the text is invariant under the simultaneous exchange of winding and momentum modes, showcasing a self-dual radius which is the simplest manifestation of T-duality in string theory. The concept of distance in cosmology is affected by the radius being greater or smaller than the self-dual radius, leading to different definitions of distance based on this criterion."
9,How does the concept of minimal length described in the text help in avoiding the big-bang singularity?,"The concept of minimal length discussed in the text suggests that distances smaller than the self-dual radius can be avoided, as the physics at those distances is equivalent to the physics at distances greater than the self-dual radius. This offers a way to avoid the big-bang singularity by ensuring that the physics remains consistent even at very small distances, preventing the need for singularities."
10,How do winding modes and the tension associated with them influence the size of corresponding circles according to the text?,"The winding modes and their associated tension can favor a small value for the corresponding circles. When winding modes annihilate with modes of the opposite winding, the corresponding circle can grow to be as large as possible, essentially de-compactifying. This implies that the energetics of winding modes play a role in determining the sizes of circles in the compactified dimensions."
11,How do winding strings in the context of the text allow for a possible explanation of our observed universe having three large dimensions?,"The text mentions that winding strings can annihilate in three spatial dimensions, allowing these dimensions to become large. This phenomenon offers a potential explanation for the fact that we observe three large dimensions in our universe. By allowing winding strings to annihilate in three dimensions, other compactified dimensions may remain hidden or small compared to the large dimensions we experience, providing a way to address the dimensionality of spacetime in our observable universe."
12,What are the implications of using a gas of strings and branes in the stress-energy tensor contribution to the density and pressure of the universe in early universe cosmology?,"By incorporating a gas of strings and branes in the stress-energy tensor contribution, it is expected that at the critical Hagedorn temperature, there will be a phase transition to a new phase dominated by these strings and branes. This approach allows for the exploration of cosmological implications by considering higher temperatures as we extrapolate back in time from the present."
13,How do the ideas proposed in the text relate to the presence of chiral matter like in the Standard Model in realistic set-ups?,"The text highlights that the ideas proposed, while attractive, have mainly been formulated in simplistic cases with all dimensions being circles. Realistic scenarios, such as those with chiral matter like in the Standard Model, present challenges that need to be addressed for a more comprehensive understanding of the cosmological implications."
14,What role does the stabilization of the dilaton play in the scenario where strings under tension cause cycles to shrink?,"In the context where strings under tension cause cycles to shrink, the stabilization of the dilaton is crucial. This stabilization, achieved through mechanisms like gaugino condensation, is essential for ensuring that the intuition holds true. In the 4-dimensional Einstein frame, the radion is a combination of the string frame dilaton and radion, indicating the interplay between these components in the scenario."
15,What is the significance of the brane-world scenario in relation to the critical dimensionality of spacetime as mentioned in the text?,"The brane-world scenario posits that our observable universe is a 3-dimensional brane embedded in a higher-dimensional space. The text suggests that for D4 branes to avoid annihilation, they need to live in a universe with dimension higher than three, implying a bound on the brane dimensionality to be less than four. This discussion adds to the arguments for the critical dimensionality of spacetime."
16,How do D3 and D7 branes relate to the Standard Model and what is their connection to F-theory and local D-brane constructions?,D3 and D7 branes are singled out in IIB string theory as particularly important. They are the branes that can host the Standard Model in F-theory and other local D-brane constructions of the Standard Model. This highlights the role these branes play in string theory constructions and their potential implications for particle physics.
17,"What is scale factor duality as discussed in the text, and how does it relate to the symmetry in the equations of motion for cosmological backgrounds?","Scale factor duality, as described in the text, is a symmetry of the equations of motion in cosmological backgrounds. It involves a transformation where the scale factor and a scalar field undergo specific changes. This symmetry, known as T-duality, relates expanding and contracting universes by transforming the scale factor and other relevant quantities. Gasperini and Veneziano combined this symmetry with time-reversal symmetry to explore cosmological scenarios before the traditional Big Bang, where the Hubble parameter increases instead of decreases."
18,How do Gasperini and Veneziano propose to combine symmetries to study cosmology before the big bang?,"Gasperini and Veneziano combine scale factor duality with the standard time-reversal symmetry $T_H$6 to allow for the consideration of cosmology before the big bang. By combining these symmetries, they introduce the possibility of scenarios where the Hubble parameter can increase instead of decrease, leading to an acceleration of the universe from negative times towards the big bang."
19,"In the context of Pre Big-Bang Cosmology, how does the transformation of $g_{MN}$ lead to different branches of solutions for the universe's evolution?","By applying the transformation of $g_{MN}$7 and incorporating duality, Gasperini and Veneziano are able to generate four different branches of solutions for the universe's evolution. These solutions manifest as different forms of the scale factor $a(t)$, such as $a(t) = t^{\pm 1/\sqrt{d}}$ for $t>0$ and $a(t) = (-t)^{\pm 1/\sqrt{d}}$ for $t<0$. In two of these branches where $g_{MN}$9, the universe expands, presenting a unique realization of the pre big-bang scenario."
20,How do Gasperini and Veneziano address the issue of singularities and strong string coupling in the pre big-bang scenario?,"Gasperini and Veneziano's proposed solutions in Pre Big-Bang Cosmology do encounter singularities, such as at $\varphi$0, where the dilaton blows up, indicating strong string coupling. However, they hope that non-perturbative string effects can provide a mechanism for a smooth matching between the different branches of solutions, thereby resolving the singularities and the associated issues with strong string coupling in the pre big-bang scenario."
21,What is the main challenge related to the graceful exit problem in the scenario described in the text?,"The main challenge related to the graceful exit problem in the scenario is the smooth transition from the pre to post Big-Bang period. This transition necessitates going through and describing the big-bang singularity, which poses a major challenge to the theoretical framework being used."
22,How does the increase in dilaton and curvature near the Big Bang affect the perturbative treatment of string theory?,"Near the Big Bang, the increase in dilaton and curvature leads to strong string coupling, which invalidates the perturbative treatment of string theory. This poses a significant obstacle in addressing the graceful exit problem within the theoretical framework."
23,Why are moduli and stabilisation of extra dimensions important factors that are neglected in the analysis of the scenario described in the text?,Moduli and the stabilisation of extra dimensions are crucial factors because neglecting them introduces uncertainties and limitations in the analysis. The presence of moduli and the stability of extra dimensions are essential for a comprehensive understanding of the scenario and for addressing issues related to the transition between different phases in the evolution of the universe.
24,"What is the scale factor duality symmetry in the context of the ekpyrotic scenario, and why is it not clearly realized in more realistic settings with nontrivial matter content?","The scale factor duality symmetry relates solutions where the scale factor a(t) is traded for 1/a(t) and the dilaton field is inverted. In more realistic settings with nontrivial matter content, such as in the presence of various fields, symmetries may be broken since matter fields can couple differently to the dilaton field, leading to an effective breakdown of the scale factor duality symmetry."
25,"How does the eventual fixing of the dilaton field by non-perturbative effects change the setting of the ekpyrotic scenario, and what implications does this have for the scenario's viability?","The dilaton field, a key component in string theory, is expected to be stabilized by non-perturbative effects in a more complete theory. This stabilization may alter the dynamics of the ekpyrotic scenario, potentially modifying predictions and outcomes. It is crucial to understand how the fixed dilaton affects the evolution of the Universe in this context and whether it impacts the viability of the ekpyrotic scenario as a whole."
26,"What are some of the interesting potential signatures from gravitational waves that have emerged from the study of the ekpyrotic scenario within the context of string theory, and how might these be relevant for experimental searches?","The study of the ekpyrotic scenario has hinted at potential signatures in gravitational wave patterns that could differentiate it from inflationary models. These signatures may arise due to specific features of the ekpyrotic scenario, such as the generation of gravitational waves at the collision of the two branes. Recognizing and characterizing these unique gravitational wave signals could provide crucial observational tests to distinguish between different early Universe scenarios. These findings can guide experimental searches for gravitational waves, offering a distinct signature to look for and potentially shedding light on the true nature of the cosmic evolution."
27,How does compactification on a six-dimensional Calabi-Yau manifold lead to the formation of two 4D worlds at the ends of the interval in the 5D bulk?,Compactification on a six-dimensional Calabi-Yau manifold results in a reduction of dimensions such that only 4 dimensions remain observable in the resultant 4D worlds at the ends of the interval in the 5D bulk. The topological properties of the Calabi-Yau manifolds play a critical role in shaping the characteristics of quasi-realistic models obtained through this process.
28,What are the key differences between end of the world branes (boundary branes) and five-dimensional branes (M-branes) in these compactifications?,"End of the world branes are fixed at the boundaries of the interval and are referred to as boundary branes. On the other hand, five-dimensional branes, known as M-branes, are not restricted to the fixed points and can move freely through the bulk. The mobile nature of these M-branes distinguishes them from the boundary branes and they are termed as bulk branes."
29,"How do theoretical models such as the Horava Witten scenario propose the formation of chiral matter, interesting cosmology, and density perturbations in the context of brane collisions without the need for inflation potential?","The Horava Witten scenario suggests that two surfaces or end of the world branes can serve as sources for chiral matter and intriguing cosmological phenomena in models such as the ekpyrotic/cyclic scenario, where ripples on the mobile brane potentially lead to density perturbations, mimicking those observed in the cosmic microwave background (CMB). The collision of a hidden bulk brane with a visible boundary brane is proposed as an alternative to inflation, with small quantum fluctuations on the bulk brane generating the density fluctuations observed without requiring an inflation potential."
30,What is the proposed role of the potential $\varphi$5 in the described scenario and how does it relate to the separation of branes?,"The potential $\varphi$5 in the scenario is proposed to describe the attraction of the branes in the absence of an inflation potential. It is related to the separation of the branes, with $\varphi$6 representing this separation. This potential is not derived but is crucial in describing the dynamics and interactions between the branes in the scenario."
31,How does the warp factor in the 5D metric affect the motion of the branes and the scale factor in the proposed scenario?,"The 5D metric in the scenario incorporates a warp factor that influences the motion of the branes. This warp factor implies that the motion is from smaller to larger curvature across the interval, leading to a position-dependent scale factor. Therefore, the scale factor of the universe in this scenario is intricately linked to the position of the brane within the extra-dimensional interval."
32,"What are the primary criticisms leveled against the ekpyrotic scenario described in the text, particularly regarding addressing standard inflationary problems?","One of the significant criticisms of the ekpyrotic scenario is its challenges in addressing standard inflationary problems. Critics point out that issues like the horizon and flatness problems necessitate the branes to be almost perfectly parallel before collision, potentially requiring fine-tuning of initial conditions. Additionally, unlike inflation, there is no general natural dilution mechanism in the ekpyrotic scenario, making it harder to solve these cosmological problems effectively. The transition from a contracting phase to an expanding phase without encountering a singularity also poses a significant obstacle due to violations of the null energy condition."
33,How do the energy density and pressure relate to the scalar field and potential in the given Lagrangian formulation?,"The energy density, denoted as ρ, is given by ρ = 1/2(∂μϕ)(∂μϕ) + V(ϕ), and the pressure, denoted as p, is given by p = 1/2(∂μϕ)(∂μϕ) - V(ϕ). These expressions for ρ and p are derived from the Lagrangian ${\cal L} = \sqrt{-g}(R - 1/2 \partial_\mu\phi \partial^\mu\phi - V(\phi))$ where g denotes the determinant of the metric tensor and R is the Ricci scalar."
34,"How does the time derivative of the Hubble parameter relate to the energy density and pressure, and what implications does it have on the evolution of the universe?","According to the given equation, $\dot{H} = -(1/2)(\rho + p) = -(1/2)\dot{\phi}^2$. This implies that the time derivative of the Hubble parameter is related to the energy density and pressure. The negative sign indicates that the Hubble parameter decreases with time due to the presence of matter (energy density and pressure), implying a decelerating expansion or approaching a contraction in the universe."
35,How does the scenario involving the collision of two end-of-the-world branes address the issue of transitioning from contraction to expansion in the context of extra dimensions?,"In the scenario described, the collision of two end-of-the-world branes leads to a singularity at the moment of collision where the size of the extra dimension reduces to zero. This occurrence allows for a potential transition from contraction to expansion since the extra dimension reaches a minimal size and could initiate the separation of the branes, leading to an increase in their scale factors and the expansion of the universe along the visible dimensions while the branes interact in the extra dimension."
36,What is the main concept behind the cyclic universe theory and how does it compare to inflation in addressing cosmological issues?,"The cyclic universe theory proposes that the universe undergoes an infinite series of cycles, each beginning with a bounce rather than a singularity. This bounce leads to causal contact, addressing issues such as the horizon problem, similar to inflation. The late period of mild inflation in the cyclic universe resolves problems like the flatness and monopole problems, akin to the role of inflation early in the universe's history."
37,"What challenges have researchers faced when trying to validate the cyclic universe theory, particularly in terms of perturbations and observational consistency?","One of the challenges in validating the cyclic universe theory relates to the consistency of perturbations with observational data. While some claims exist about the perturbation spectrum aligning with observations, the methods used so far have not provided conclusive evidence. Debates continue among researchers regarding the validity of these claims and the overall observational consistency of the cyclic universe theory."
38,How does the cyclic universe theory address the entropy problem that was a significant limitation in the earlier proposals of a cyclic universe?,"In earlier versions of a cyclic universe, the entropy problem arose due to increasing entropy in each cycle, leading to an inevitable initial singularity and thus a lack of true cyclic behavior. However, in the current version of the cyclic universe theory, the entropy issue is resolved by maintaining the entropy of matter constant at the end of each cycle. This is facilitated by the accelerated expansion diluting matter and essentially emptying the universe before the next cycle begins, ensuring a consistent entropy state at the end of each cycle."
39,"What is the key concept behind the scenario discussed in the text, and how does it connect the early universe to the late universe?","The key concept behind the scenario discussed in the text is that it involves a period of contraction leading to a bounce, which connects the early universe and late universe in a coherent way. This scenario suggests that the current acceleration of the universe is preparing it for the next cycle. It aims to address the big-bang singularity problem by proposing a bounce instead of a singularity."
40,What specific challenges related to string theory are highlighted in the text regarding the proposed scenario?,"The text mentions that although the scenarios were motivated in terms of string theory, the scalar potentials required for the scenario to work are relatively contrived and have not been derived from the underlying theory. This lack of explicit derivation of the scalar potentials from string theory poses a significant challenge to these models being considered genuine string/M-theory models. Additionally, assumptions such as the fixed and decoupled moduli of the Calabi-Yau manifold are mentioned as unjustified within the context of string theory."
41,What are some of the unresolved issues and open challenges for the scenarios discussed in the text?,"One of the main unresolved issues for the scenarios discussed in the text is finding a scalar potential that possesses the necessary properties for the scenario to be viable. This represents a clear open challenge for the models to be further developed and validated. The description of the bounce itself is also highlighted as a significant challenge, as it relies on strong coupling and non-perturbative dynamics, which are aspects not fully understood in the context of string theory. Moreover, the overall assumption of a bounce instead of a big-bang singularity presents a major challenge that needs to be addressed for these models to be fully developed and tested."
42,What role does the open string tachyon play in brane anti-brane inflation according to the text?,The open string tachyon plays a crucial role in brane anti-brane inflation as it provides a natural way to end inflation and is the source of production of lower dimensional branes like stringy cosmic strings.
43,How has progress in understanding the physics of the open string tachyon been made from first principles?,"Significant progress has been made in understanding the physics of the open string tachyon from first principles, particularly through string field theory. Sen managed to extract substantial information regarding the tachyon potential, which is one of the only cases where a scalar potential has been derived directly from string theory."
