,Question,Answer
86,How is the metric structure of de Sitter space translated into the understanding of scaling transformations on the Euclidean boundary in the dS/CFT correspondence?,"The metric structure of de Sitter space can be recast in FRW (Friedmann-Robertson-Walker) coordinates to elucidate the scaling transformations on the Euclidean boundary. The metric, with spatial coordinates $\vec{x}$ and the Hubble parameter $H$, exhibits invariance under certain transformations that generate time evolution in the bulk and scale transformations on the boundary. This symmetry allows for the connection between late times (UV regime) corresponding to small distances and earlier times linked to low energies (IR regime)."
87,What is the relationship between the RG flow and the direction from future to past mentioned in the text?,"The RG (Renormalization Group) flow in theoretical physics corresponds to the changes in a physical system as one ""zooms out"" or changes the energy scale. In the text, it is mentioned that the RG flow corresponds to the direction from future to past. This typically means that at high energies (future), the theory is in the UV (ultraviolet) regime where particles interact strongly, while at low energies (past), the theory is in the IR (infrared) regime where particles interact weakly."
88,What is the dS/dS correspondence discussed in the text and how does it differ from the AdS/CFT correspondence?,"The dS/dS correspondence proposed in the text suggests a duality between two de Sitter spaces in different dimensions. Specifically, a dS (de Sitter) space in one dimension is proposed to be dual to another dS space in a lower dimension. This concept is similar to the AdS/CFT (Anti-de Sitter/Conformal Field Theory) correspondence, which relates a gravitational theory in an AdS space to a quantum field theory on its boundary. However, in the dS/dS correspondence, the dual is not a field theory without gravity but rather a lower dimensional de Sitter space with a massless graviton."
89,"How are quantum extremal surfaces (QES) used to generalize the expression for the von Neumann entropy, as mentioned in the text?","Quantum extremal surfaces (QES) are a concept introduced in the context of black holes and quantum gravity. In the text, it is mentioned that QES are used to generalize the expression for the von Neumann entropy. The von Neumann entropy is a measure of the amount of uncertainty or randomness in a quantum system. By considering QES, which are certain surfaces related to the entanglement structure of the system, researchers are able to extend the understanding of entropy and its connections to the information loss paradox in black holes. The QES play a crucial role in refining the calculations and interpretations related to the entropy of quantum systems."
90,What is the significance of quantum extremal surfaces (QES) in the context of generalizing the expression for the von Neumann entropy?,"Quantum extremal surfaces (QES) are crucial in the generalization of the expression for the von Neumann entropy as they provide a framework for understanding the time evolution of entropy in quantum systems, particularly in black hole physics. This framework helps in addressing the information loss paradox and is essential for achieving unitary evolution in quantum systems."
91,How do entanglement islands influence the calculation of entropy behind black hole horizons?,"Entanglement islands are regions behind black hole horizons that harbor the necessary degrees of freedom to prevent information loss. These entanglement islands play a key role in calculating the entropy in quantum systems and are crucial for the formulation of concepts like quantum extremal surfaces, which are fundamental in understanding the evolution of black holes and quantum information."
92,How do recent developments in quantum extremal surfaces and entanglement islands impact our understanding of quantum cosmology and the emergence of spacetime?,Recent advancements in quantum extremal surfaces and entanglement islands have significant implications for our comprehension of quantum cosmology and the emergence of spacetime. These concepts provide insights into the fundamental nature of spacetime and have opened new avenues for exploring connections between gravitational theories and quantum entanglement. The study of these ideas not only sheds light on black hole physics but also holds promise for broader applications in cosmology and the emergence of spacetime itself.
93,What is the ER=EPR proposal in the context of the connection between gravitational theories and quantum entanglement?,"The ER=EPR proposal suggests a connection between the Einstein-Rosen wormhole and the Einstein-Podolsky-Rosen entanglement. It posits that entangled particles are connected by a wormhole, implying that quantum entanglement could be the fundamental building block of spacetime itself."
94,Why has it been more challenging to implement the emergence of time compared to spatial dimensions in the context of gravitational theories and quantum entanglement?,"Implementing the emergence of time has been more challenging compared to spatial dimensions due to the non-unitary nature of the evolution in quantum mechanics, which introduces complexities when trying to reconcile quantum entanglement with the reconstruction of spacetime. Time, being a directional and irreversible dimension, poses unique challenges in such a framework."
95,What is the significance of matrix models in string cosmology and how do they relate to non-perturbative formulations of string theory?,"Matrix models are significant in string cosmology as they provide a non-perturbative formulation of string theory, which is crucial for understanding string theory beyond its perturbative approximation. Matrix models, along with the AdS/CFT correspondence, are among the few proposals that offer non-perturbative insights into string theory, potentially opening new avenues for research and theoretical developments in the field."
