,Question,Answer
41,How do the constraints on the number of axions and Calabi-Yau volume in the model affect the stabilization of saxions at a perturbative level?,"The constraints on the number of axions, requiring a large number $N\gtrsim 10^5$, and the Calabi-Yau volume, necessitating a relatively small volume $\mathcal{V}\simeq 10^3, in the model have implications for the stabilization of saxions at a perturbative level. The large number of axions and specific volume requirements introduce challenges in controlling the stabilization of saxions within the model, potentially leading to difficulties in achieving stable configurations that align with observational data and theoretical expectations."
42,How does the Axion Monodromy scenario differ from other inflationary models in terms of underlying symmetries and observational implications?,"The Axion Monodromy (AM) scenario differs from other inflationary models by incorporating a broken axionic shift symmetry at tree-level, offering the potential to minimize fine-tuning while also enabling comparisons with observational data on shorter time scales. The inflationary potential in AM is power-law and can be driven by closed string axions."
43,What are the main differences between the inflation driven by the $B_2$-axion $b$ and the $C_2$-axion $c$ in the context of Axion Monodromy models?,"In the context of Axion Monodromy models, the main difference between inflation driven by the $B_2$-axion $b$ and the $C_2$-axion $c$ lies in the fact that the $B_2$-axion $b$ appears in the Kähler potential, leading to complications such as the $\eta_V$-problem. On the other hand, the $C_2$-axion $c$ does not suffer from the same issue and is considered a more promising candidate to drive axion monodromy due to the absence of such problems."
44,"How do backreaction effects impact Axion Monodromy models, and what potential solutions or considerations exist for addressing these effects?","Backreaction effects in Axion Monodromy models, as in the discussed scenario, may introduce challenges that need to be addressed. In particular, the model is affected by backreaction effects that can be mitigated by incorporating bifurcated throats as suggested in the literature. These solutions aim to handle the issues arising from backreaction and maintain the consistency of the model with observational constraints."
45,What are bifurcated throats and how do they address backreaction effects in the model mentioned in the text?,"Bifurcated throats are a theoretical construct used in string theory and braneworld scenarios where the geometry of spacetime bifurcates into separate regions resembling 'throats'. These throats can be used to address backreaction effects by providing a way to localize different types of matter fields or interactions in distinct regions, thereby mitigating the impact of backreactions."
46,"How do flattening effects in the inflationary potential, arising from interactions with heavy fields, impact the tensor-to-scalar ratio in the model discussed in the text?","Flattening effects in the inflationary potential, resulting from interactions with heavy fields that have been integrated out, can lead to a shallower potential for the inflaton field. This shallower potential can reduce the tensor-to-scalar ratio, potentially bringing it into better agreement with observational data when compared to models with steeper potentials that yield large tensor modes."
47,Can you explain how the cosine modulation of the scalar potential mentioned in the text affects the scalar power-spectrum and non-Gaussianities in the context of the discussed model?,"The cosine modulation of the scalar potential, generated by non-perturbative effects, introduces oscillations in the scalar power-spectrum. These modulations can lead to resonant non-Gaussianities in the primordial density fluctuations. Depending on the size and scale of these modulations, they can significantly alter the background evolution during inflation, enabling successful inflation for smaller field ranges while involving sub-Planckian decay constants, which is particularly relevant in scenarios like axion monodromy inflation."
48,What are the key features and implications of potentials in the context of the production of primordial black holes and dark matter?,"The text discusses how modulated potentials can lead to the production of abundant primordial black holes which could constitute part or all of the dark matter component in the universe. It suggests that different forms of axion monodromy potentials can result in diverse inflaton potentials, allowing for phenomena such as linear large field behavior and chaotic inflation."
49,How is the shift symmetry of the axion broken in the proposed alternative axion monodromy mechanism discussed in the text?,"In the alternative axion monodromy mechanism described in the text, the shift symmetry of the axion is broken by background fluxes, leading to the generation of a non-oscillatory term in the potential. This breaking of the shift symmetry allows for the creation of inflaton potentials with different features, including linear large field behavior, chaotic inflation, and potentials with higher powers."
50,Can you elaborate on how modulations of potentials can impact the behavior of inflation and the associated parameters such as the tensor-to-scalar ratio and the axion decay constants?,"The text mentions that subleading but significant modulations can introduce steep cliffs and gentle plateaus in the potential landscape, affecting the dynamics of inflation. This influence can lead to a sufficient duration of inflation with smaller field ranges, reducing the tensor-to-scalar ratio. Moreover, it can enable scenarios like natural inflation with sub-Planckian axion decay constants, providing insights into the viability of inflationary models within these frameworks."
51,What is the significance of achieving natural inflation with sub-Planckian axion decay constants in the context of theoretical physics?,"Achieving natural inflation with sub-Planckian axion decay constants is significant in theoretical physics because it allows for the possibility of inflation models that are compatible with observational constraints while exploring fundamental aspects of particle physics and cosmology, such as axion physics and the properties of the early Universe."
52,How do D7-deformation moduli and the approximate shift symmetry at large complex structure contribute to protecting the inflaton potential in stringy realizations of both large and small field models of inflation?,"D7-deformation moduli possess an approximate shift symmetry at large complex structure, which can act as a protective mechanism for the inflaton potential in string theory models of inflation. This protection enables the realization of both large and small field inflation models within the framework of string theory, offering insights into the interplay between moduli stabilization and inflationary dynamics."
53,Can you elaborate on the mechanism by which three-form fluxes break the symmetry in the large field case and develop a scalar potential suitable for chaotic inflation within string theory models?,"In the large field case of string theory inflation models, the approximate shift symmetry of the D7-deformation moduli is broken by the presence of three-form fluxes. This breaking of symmetry leads to the generation of a tunable scalar potential that exhibits typical chaotic inflation features, such as a quadratic dependence on the inflaton field. This mechanism provides a framework for constructing inflation models within string theory that are consistent with observational constraints and can be further explored in the context of early Universe cosmology."
54,How does the separation between branes in string theory drive inflation in the $\overline{\rm D3}$ inflation model?,"In the $\overline{\rm D3}$ inflation model in string theory, inflation is realized by using the separation between D-branes and anti-D-branes as the field driving inflation. When there are D-branes and anti-D-branes present, a Coulomb attraction arises which gives rise to a scalar potential for the brane separation. The inflaton in this model is the open string modulus controlling the distance between the D3 and the $\overline{\rm D3}$ brane, leading to inflation as they move towards each other."
55,How does the Coulomb potential for systems of D3-$\overline{\rm D3}$ branes in warped compactifications affect the inflation process?,"The Coulomb potential for systems of D3-$\overline{\rm D3}$ branes in warped compactifications plays a crucial role in the inflation process. The potential is denoted by $\Delta V = c\, V(\phi)\left(\frac{\phi}{\Lambda}\right)^2$, where the overall scale of the potential is set by the warped anti-D3-brane tension. Warping in the compactifications can be used to achieve slow-roll conditions necessary for inflation to occur, and the form of the potential contributes to the inflationary dynamics in these setups."
56,Can you elaborate on the significance of the brane-antibrane inflation set-up in the context of string theory models of inflation?,"The brane-antibrane inflation set-up is significant in the context of string theory models of inflation because it provides a mechanism for realizing inflation within the framework of string theory. By considering configurations with warped compactifications and using the Coulomb potential arising from the D3-$\overline{\rm D3}$ branes, researchers can study the dynamics of inflation and how string theory can be used to describe these cosmological phenomena. This set-up offers insights into how brane configurations and their interactions can give rise to the inflationary scenario observed in the early universe."
57,"What is the significance of the Coulomb potential for systems of D3-$\overline{{\rm D3}}$ branes in warped compactifications, and how does it influence the slow-roll parameters in inflationary models?","The Coulomb potential for D3-$\overline{{\rm D3}}$ branes in warped compactifications plays a crucial role in inflationary models as it affects the scalar field dynamics during inflation. In particular, it can lead to the generation of the scalar potential that controls the inflationary process. The potential can be written as $\Delta V = c\, V(\phi)\left(\frac{\phi}{\Lambda}\right)^2$, where $c$ is a constant and $V(\phi)$ is the scalar potential. This potential is responsible for determining the slow-roll parameters $\eta_V$ and $\epsilon$ in the inflationary model."
58,How does the warped $\overline{{\rm D3}}$-brane tension influence the overall scale of the potential in the context of D3-$\overline{{\rm D3}}$ brane systems?,"The overall scale of the potential in the context of D3-$\overline{{\rm D3}}$ brane systems is set by the warped $\overline{{\rm D3}}$-brane tension. Specifically, the scale is given by $V_0 \simeq T_3\,e^{4 A(r_{\rm IR})}$, where $T_3$ represents the tension of the $\overline{{\rm D3}}$-brane and $A(r_{\rm IR})$ is the warp factor at the infrared (IR) end of the geometry. This relation highlights how the brane tensions and the geometry of the compactification space are intertwined in determining the overall scale of the potential."
59,"What role does the motion of a D5-brane wrapping a 2-cycle play in extending the field range in the context of D3-brane inflation, and why is it essential to check for backreaction effects in this scenario?","The motion of a D5-brane wrapping a 2-cycle can extend the field range in D3-brane inflation models, allowing for variations in the scalar field dynamics during inflation. This extension of the field range introduces new possibilities for inflationary scenarios. However, it is crucial to check for backreaction effects caused by the presence of the D5-brane. Backreaction effects can alter the background geometry and energy densities, potentially impacting the inflationary dynamics and the overall consistency of the model. By examining backreaction effects, researchers can ensure the robustness and validity of the proposed inflationary scenario involving D5-branes in the context of brane cosmology."
60,What is the significance of the tachyon reaching a minimum of its potential at the end of inflation in the context of string cosmology?,The significance of the tachyon reaching a minimum of its potential at the end of inflation in the context of string cosmology is tied to the generation of cosmic strings (D1-branes) as one of the few observable implications of string cosmology. This phenomenon is directly related to the unique nature of string theory's predictions regarding the evolution of the universe at the end of inflation.
61,How does the concept of the disappearance of the inflaton field in D3-$\overline{{\rm D3}}$ inflation illustrate a distinctive possibility within string inflation?,"The disappearance of the inflaton field in D3-$\overline{{\rm D3}}$ inflation showcases a distinctive aspect of string inflation where the inflaton field, which is the position modulus of the D3-brane, is entirely removed from the effective field theory after brane-antibrane annihilation. This contrasts with traditional field theory scenarios where the inflaton field generally persists in some form even after inflation."
62,How does the Kuperstein embedding in the D3-$\overline{{\rm D3}}$ inflation model address the $\eta_V$-problem and induce inflation near an inflection point in the potential?,"In the D3-$\overline{{\rm D3}}$ inflation model, the Kuperstein embedding plays a crucial role in addressing the $\eta_V$-problem by introducing two contributions to the slow-roll $\eta_V$-parameter with opposite signs. This arrangement ensures that $\eta_V$ remains significantly less than 1, allowing for inflation near an inflection point in the potential. The model's potential can be expanded in a controlled manner, as described by the equation $\Delta \eta_V = 2c \left(\frac{M_{\rm Pl}}{\Lambda}\right)^2$, offering insights into the dynamics of inflation in this string theory framework."
63,What are the implications of having $N_e^{\rm tot}\lesssim 120$ versus $N_e^{\rm tot} \gg 2N_e$ in terms of the scalar spectral index during inflation?,"Having $N_e^{\rm tot}\lesssim 120$ implies that the scalar spectral index $n_s$ is greater than 1, while $n_s$ is approximately equal to $1 - \frac{4}{N_e}$ for $N_e^{\rm tot} \gg 2N_e$. In the specific case of $N_e\simeq 52$, $n_s\simeq 0.923$, which represents a very blue spectrum."
64,How does the tensor-to-scalar ratio $r$ behave in the small-field inflation model mentioned in the text?,"In the small-field inflation model described, the tensor-to-scalar ratio $r$ is negligible, with $r \lesssim 10^{-6}. This implies that the inflationary model being discussed does not exhibit significant gravitational wave production."
65,"How is the inflationary potential in the D3-D7 systems modified by the presence of K\""ahler moduli freezing due to gaugino condensation on D7-branes?","In the D3-D7 systems considered, the K\""ahler moduli can be stabilized by gaugino condensation on D7-branes, leading to additional contributions to the inflationary potential. The mixing between the K\""ahler and D3-brane position moduli in the K\""ahler potential results in a modification of the inflationary potential, as expressed in the final formula provided in the text."
66,"What are the implications of quantum corrections, such as $\alpha'$ effects, on the inflationary trajectory in this model?","Quantum corrections, like $\alpha'$ effects, can potentially destabilize the real part of the underlying parameters or make the potential steeper along the imaginary part in the inflationary trajectory of the model. This interference from quantum corrections may influence the behavior of the model and alter its predictions."
67,How does the volume modulus of type IIB string compactifications affect the inflationary dynamics in this scenario?,"In the context described in the text, the volume modulus of type IIB string compactifications does not possess an approximate rescaling symmetry due to explicit dependence on $\mathcal{V}$, breaking the no-scale structure. With sufficient tuning freedom, the volume mode can contribute to driving inflation near an inflection point induced by various factors, including higher-order effects."
68,How does the scalar potential for the inflaton change with respect to the canonically normalized inflaton field in this model?,"The scalar potential for the canonically normalized inflaton field in this model can be described by a term $\Delta \eta_V = 2c\left(\frac{M_{\rm Pl}}{\Lambda}\right)^2$, where $\Lambda \lesssim M_{\rm Pl}$ and the coefficients are flux-dependent of order $\mathcal{O}(1)$. The model exhibits an inflection point around $\phi\simeq \mathcal{O}(7)$ and a minimum at $\phi\simeq \mathcal{O}(24) which could provide insights into the dynamics of the cosmological model being studied."
69,How do models with a large tuning freedom manage to reproduce the scalar spectral index but lead to unobservable tensor modes in inflationary scenarios?,Models with a large tuning freedom can reproduce the observed value of the scalar spectral index but make tensor modes unobservable in inflationary scenarios due to the specific characteristics and constraints inherent in the model design.
70,Why is it important for the inflationary energy density not to exceed the height of the barrier towards decompactification in viable inflation models?,"It is crucial for the inflationary energy density not to surpass the height of the barrier towards decompactification in viable inflation models to prevent the volume mode from running away to infinity, ensuring the stability and feasibility of the model."
71,How can high-scale inflation be reconciled with low-energy supersymmetry in the context of theoretical physics models like KKLT and LVS models?,"High-scale inflation can be reconciled with low-energy supersymmetry in theoretical physics models like KKLT and LVS models by imposing constraints on the inflationary scale based on the mass of the supersymmetric partners, thus establishing a relationship between the inflationary scale and the constraints imposed by supersymmetry."
72,How does the dependence of the gravitino mass on the $\mathcal{V}$ field impact inflation scenarios?,The dependence of the gravitino mass on the $\mathcal{V}$ field affects inflation scenarios by potentially allowing for a much higher gravitino mass during inflation compared to the present-day value. This can have implications for the dynamics and energy scales associated with inflationary models.
73,What is the significance of the DBI inflation scenario and its non-canonical kinetic terms in the context of theoretical physics?,The DBI inflation scenario is significant in theoretical physics as it presents a framework beyond the slow-roll approximation for achieving accelerated expansion. Non-canonical kinetic terms arising from the DBI action introduce new dynamics that can lead to unique inflationary phenomenology and contribute to the understanding of early universe dynamics.
74,How do the UV-model and IR-model scenarios differ in the context of a D3-brane moving in a warped throat during inflation?,"The UV-model and IR-model scenarios for a D3-brane moving in a warped throat during inflation differ in the direction of the brane's movement within the throat. In the UV-model, the brane moves from the UV end of the throat towards its tip, while in the IR-model, the brane moves from the tip of the throat to its UV end. These different scenarios can have distinct implications for the resulting inflationary dynamics and observational signatures."
75,What are the differences between the UV-model and the IR-model in the context of brane dynamics in a warped throat?,"The UV-model involves the brane moving from the UV end of the throat towards its tip, while in the IR-model, the brane moves from the tip of the throat to its UV end. These scenarios showcase distinct directions of brane motion within the warped throat."
76,"How does the scalar potential vary in the UV-model and the IR-model, and what implications does this have for the dynamics of the system?","In the UV-model, the scalar potential is characterized by $\Delta \eta_V = 2c\left(\frac{M_{\rm Pl}}{\Lambda}\right)^2$ where $\Lambda \lesssim M_{\rm Pl}$, reflecting the motion of the brane from the UV towards the tip of the throat. This potential influences the dynamics of the system differently compared to the IR-model, where the brane moves in the opposite direction. Understanding these potentials is crucial for studying the behavior of the brane within the warped throat."
77,What role do the non-canonical kinetic terms play in the context of accelerated expansion and the effective speed limit on the motion of D3-branes in DBI inflation?,"The non-canonical form of the kinetic terms in DBI inflation imposes a speed limit on the motion of the D3-brane, leading to accelerated expansion. This speed limit, coupled with the assumption that quantum and backreaction effects do not alter the Lagrangian form, contributes significantly to the dynamics of the system and the resulting inflationary behavior. Understanding the impact of these kinetic terms is crucial for studying the acceleration mechanism in this context."
78,"What is the significance of the DBI Lagrangian in theoretical physics, and how does it relate to $P(X, \phi)$ theories?","The DBI Lagrangian is important in theoretical physics, particularly in the context of inflationary cosmology. It is a specific case of the more general Lagrangian defined by $P(X, \phi)$ theories. In these theories, the Lagrangian is given by ${\mathcal L} = P(X, \phi)$, where $X\equiv -\frac{1}{2}(\partial\phi)^2$ and $P(X, \phi)$ is an arbitrary function of $X$ and $\phi. DBI inflation, a specific case within this framework, is characterized by a Lagrangian of the form $P(X, \phi) = -T(\phi)\left(\sqrt{1-\frac{2X}{T(\phi)}}-1\right) - V(\phi)$."
79,"How does the equation of motion for Fourier modes in DBI inflation differ from standard cases, and what is the significance of the modified equation?","In DBI inflation, the equation of motion for the Fourier modes of the curvature perturbation $R_k$ is modified and given by $R''_k + 2\frac{z'}{z}R_k' + c_s^2 k^2 R_k = 0$. Here, $c_s^2 = \frac{P_X}{P_X + 2XP_{XX}}$ represents the sound speed, which plays a crucial role in the dynamics of the inflationary model. The modified equation reflects the non-trivial interactions between the inflaton field and spacetime curvature that are characteristic of DBI inflation."
80,"How does the change in the sound speed impact the scalar power spectrum in DBI inflation, and what are the key expressions involved?","In DBI inflation, the change in the sound speed affects the scalar power spectrum, as given by the expression $P_R = \frac{H^2}{8\pi^2M_p^2 \epsilon c_s}\bigg|_{k=aH}$. This expression indicates that the scalar power spectrum is influenced by the sound speed parameter $c_s$, the Hubble parameter $H$, the reduced Planck mass $M_p$, and the slow-roll parameter $\epsilon$, all evaluated at horizon crossing. The relationship between the sound speed, the scalar power spectrum, and the inflationary dynamics highlights the impact of DBI inflation on observable quantities in the early universe."
81,How does the amplitude of the tensor power spectrum relate to the non-relativistic case and the speed of sound in the equation of motion for tensor modes?,The amplitude of the tensor power spectrum is not modified with respect to the non-relativistic case since the speed of sound does not enter into the equation of motion for tensor modes. This means that the amplitude remains unchanged regardless of the speed of sound.
82,How are the spectral tilt and tensor-to-scalar ratio modified in the context described in the text?,"The spectral tilt (n_s) and tensor-to-scalar ratio (r) are modified as specified in the equation provided in the text: n_s = 1 - 2ε - η - s and r = 16εcs. These modifications are based on the parameters ε (related to the slow-roll parameter), η, s, and the speed of sound (cs). They impact the properties of the spectral tilt and the ratio between tensor and scalar perturbations."
83,In what ways can the violation of slow-roll conditions impact the generation of scalar perturbations and the potential formation of primordial black holes in the context of DBI inflation?,"Violations of slow-roll conditions can lead to significant changes in the generation of scalar perturbations. Large changes in the parameter H_inf can cause the decaying mode in the curvature perturbation equation to transition into a growing mode, thereby enhancing scalar perturbations. This enhancement could result in the production of abundant primordial black holes. These violations can be induced by features in the warp factor experienced by a moving D-brane, offering a mechanism for altering the inflation dynamics and the consequent perturbations."
84,"What are some examples of string inflation models mentioned in the text, and what distinguishes them from each other?","Some examples of string inflation models mentioned in the text include Fibre Inflation, Blow-up Inflation, Poly-instanton Inflation, Aligned Natural Inflation, Axion Monodromy, D7 Fluxbrane Inflation, Wilson line Inflation, D3-$\eta_V\simeq \mathcal{O}(1)$0 Inflation, Inflection Point Inflation, D3-D7 Inflation, Racetrack Inflation, Volume Inflation, and DBI Inflation. These models are distinguished from each other based on the specific mechanism through which inflation is realized, the values of the slow-roll parameters like $\eta_V$, and the predictions they make in terms of observational signatures."
