,Question,Answer
0,How do quantum effects impact scalar masses in the context of effective field theory?,"In the context of effective field theory, quantum effects tend to generate corrections to scalar masses. These corrections are typically of the order of the cut-off scale of the effective field theory, denoted as $\Lambda$, with scalar masses being of the order $\mathcal{O}(\Lambda)$."
1,How do irrelevant operators affect the slow-roll parameter $\eta_V$ in single-field inflation models?,"Irrelevant operators, characterized by terms like $\Delta V = c\, V(\phi)\left(\frac{\phi}{\Lambda}\right)^2$, can introduce corrections to the slow-roll parameter $\eta_V$. Specifically, these corrections are proportional to $c$ and the ratio of the Planck mass $M_{\rm Pl}$ to the cut-off scale $\Lambda$, with $\Delta \eta_V = 2c\left(\frac{M_{\rm Pl}}{\Lambda}\right)^2$. Such corrections can violate the slow-roll condition in single-field inflation if certain conditions on the relative scales are not met."
2,Why is a consistent UV embedding crucial in addressing the $\eta_V$-problem in single-field inflation?,"A consistent UV embedding is crucial in tackling the $\eta_V$-problem in single-field inflation because it provides the necessary symmetries to address issues like fine-tuning and small values of $\eta_V$. The presence of symmetries originating from a UV completion helps to understand why certain parameters, such as the coefficient $c$ in irrelevant operators, are naturally small. Inflationary model building relies on a robust UV embedding to ensure that fundamental principles are upheld and to enable a deeper understanding of the physics involved in inflationary scenarios."
3,What is the significance of the $\eta_V$ parameter in multi-field inflation and why does it not have to be small?,"The $\eta_V$ parameter in multi-field inflation measures the curvature of the inflaton potential along its trajectory. In the context of multi-field inflation, $\eta_V$ does not necessarily have to be small for the inflationary dynamics to be consistent. This is in contrast to the single-field inflation where a small $\eta$ is a requirement for slow-roll inflation."
4,"How is the size of the tensor fluctuation related to the field displacement of the inflaton, and why are trans-Planckian field excursions significant?","The size of the tensor fluctuation ($r$) can be related to the field displacement of the inflaton ($\Delta\varphi$) through the Lyth bound equation, indicating that large and observable values of $r$ correspond to trans-Planckian field excursions of the inflaton. Trans-Planckian field excursions are significant because they are necessary to produce observable levels of primordial gravitational waves that can be detected, providing insights into the physics of inflation."
5,How does the explicit appearance of the Planck scale in the observable quantity derived in Eq. (Lyth2) relate to the quantum gravity energy scale?,"In Eq. (Lyth2), the explicit appearance of the Planck scale serves as a unique example where the quantum gravity energy scale becomes directly relevant to an observable quantity, namely the tensor-to-scalar ratio. This connection highlights the potential interplay between the inflationary dynamics, characterized by trans-Planckian field excursions, and the fundamental scale of quantum gravity. Investigating such relationships not only has theoretical implications but also offers potential observational avenues to probe quantum gravity effects with current or future experimental capabilities."
6,"What are some challenges in attaining flat potentials over field excursions in string theory, and how does the Swampland Distance Conjecture influence this discussion?","In string theory, achieving flat potentials over field excursions is difficult due to the high energy scales involved and the Swampland Distance Conjecture adds to this by providing constraints on the allowed shapes of potentials in the theory. The conjecture suggests that certain properties of scalar fields are indicative of consistent quantum gravity theories and hence imposes limitations on the types of potentials that can arise in the context of string theory."
7,How does embedding inflation into string theory impact the understanding of initial conditions and the mechanism by which inflation commenced?,"Embedding inflation into string theory can offer insights into the delicate issue of initial conditions for inflation and the processes involved in the onset of inflation. String theory provides a framework that can potentially explain how inflation started, shedding light on the fundamental mechanisms at play during the early universe."
8,"How does the connection between string theory and inflation relate to the process of reheating at the end of inflation, and what role does the knowledge of relevant degrees of freedom play in this scenario?",The interplay between string theory and inflation is crucial in understanding the process of reheating after inflation ends. Reheating involves the transfer of energy from the inflaton field to the production of Standard Model particles. Understanding this process requires knowledge of all relevant degrees of freedom at inflationary energies to ensure efficient energy transfer without significant loss to hidden sector particles. String theory offers a framework to elucidate and potentially control this energy transfer mechanism.
9,What is the significance of having a robust UV embedding of inflation into string theory for understanding reheating after the end of inflation?,"Having a robust UV embedding of inflation into string theory is crucial for understanding reheating after the end of inflation because it enables the control of all microscopic degrees of freedom. By incorporating all relevant degrees of freedom at inflationary energies, one can ensure that the energy density of the inflaton is efficiently transferred to the production of Standard Model degrees of freedom without significant losses to hidden sector particles."
10,How important is moduli stabilization in the context of string inflation models?,"Moduli stabilization plays a vital role in the context of string inflation models. In a perfect working model of string inflation, all closed and open string moduli must be stabilized to ensure that the scalar potential features a region suitable for driving inflation without any destabilizing orthogonal runaway directions. Additionally, the scalar potential should allow for a proper description of the late-time evolution of the universe, including the reheating epoch and the presence of a de Sitter minimum or a quintessence direction."
11,Why is it necessary to maintain a specific mass hierarchy throughout the inflationary dynamics in the context of controlled low-energy effective field theory?,"It is essential to maintain a specific mass hierarchy throughout the inflationary dynamics in controlled low-energy effective field theory to ensure the stability and consistency of the model. The hierarchy, which includes the Hubble scale during inflation $(H_{\rm inf})$, the inflaton mass during inflation $(M_{\rm inf})$, and other mass scales such as the Kaluza-Klein scale $(M_{\rm KK})$, the string scale $(M_s)$, and the Planck scale $(M_{\rm Pl})$, is crucial for understanding the interactions and dynamics of different particles during inflation. This hierarchy helps in categorizing which moduli are heavy and fixed at their minimum during inflation and which ones are lighter and may impact the inflationary dynamics significantly."
12,Why is it important to analyze moduli with masses close to or smaller than the Hubble scale during inflation?,It is crucial to analyze moduli with masses close to or smaller than the Hubble scale during inflation because they can significantly affect the inflationary dynamics and potentially influence the evolution of the early universe. Understanding the behavior of these moduli is necessary for a comprehensive study of inflationary scenarios.
13,How does computational control play a critical role in constructing models of accelerated expansion within the effective field theory framework?,"Computational control is essential in constructing models of accelerated expansion within the effective field theory framework, as any viable model needs to accurately account for the quantum corrections to the scalar potential that arise from various regions of the parameter and field spaces. To ensure computational control, it is necessary to fix the sizes of all cycles above the string scale, manage perturbative expansions such as $\alpha'$ and string loop corrections, compute non-perturbative effects, and properly address the impact of fluxes and localised objects in the model."
14,Why is it emphasized that a Calabi-Yau embedding is crucial for a successful inflationary model derived from string theory?,"The emphasis on a Calabi-Yau embedding in constructing a successful inflationary model derived from string theory stems from the necessity to move beyond a simple string-inspired supergravity setup. A globally consistent Calabi-Yau (or equivalent) compactification offers a robust framework with well-defined geometric and topological properties, an explicit orientifold involution, and a brane setup. This detailed description of the underlying geometry and topology is crucial for ensuring the internal consistency and predictive power of the inflationary model within the string theory framework."
15,How important is having a globally consistent Calabi-Yau compactification in string theory research and how does it impact the field space and perturbative corrections?,"Having a globally consistent Calabi-Yau compactification is crucial in string theory research as it provides a well-defined geometric and topological framework for studying the underlying physics. The properties of the Calabi-Yau space influence the field space and the K\""ahler cone which, in turn, determine the dynamics of the theory. By understanding the Calabi-Yau compactification, researchers can analyze perturbative corrections to the K\""ahler potential and instanton contributions to the superpotential, which are essential for moduli stabilization and the generation of inflationary potential."
16,How do considerations of non-Abelian gauge groups and chiral matter in the string compactification relate to matching the Standard Model in string theory?,"Including a Standard Model-like sector with non-Abelian gauge groups and chiral matter in the string compactification is important for connecting string theory to the known particles and forces of the Standard Model. By realizing such a sector within the Calabi-Yau compactification, researchers aim to reproduce the particle content and interactions observed in experimental particle physics. This connection helps bridge the gap between string theory and the real-world phenomena studied in particle accelerators."
17,"What role do cosmological observables such as the scalar spectral index, density perturbations, and non-Gaussianities play in constraining and validating string inflation models?","Cosmological observables such as the scalar spectral index, density perturbations, and non-Gaussianities are crucial for constraining and validating string inflation models against observational data. The values of these observables are compared with experimental measurements from cosmic microwave background radiation and large-scale structure surveys. Matching these data sets helps researchers confirm the viability of their string inflation models and refine the parameters within those models. Additionally, constraints from non-Gaussianities and isocurvature modes provide further tests for the consistency and robustness of the proposed inflationary scenarios in string theory."
18,How do shift symmetries play a role in the construction of robust inflationary models in theoretical physics?,"Shift symmetries play a crucial role in constructing robust inflationary models in theoretical physics by protecting the flatness of the inflationary potential and offering an elegant solution to the $\eta_V$-problem in single-field inflation. These symmetries can be saxionic or axionic in nature, depending on the specific context, and they are approximate in practice."
19,What are the characteristics of saxionic and axionic shift symmetries in the construction of inflationary models?,"Saxionic shift symmetries involve transformations of complex moduli where the real part shifts by a real parameter, while axionic shift symmetries involve transformations where the imaginary part shifts by a real parameter. These symmetries are mathematical tools used to maintain certain properties of the potential during inflation."
20,"How can an inflationary potential take different forms depending on the effects that break shift symmetries, and how is the $\eta_V$-problem addressed in the absence of symmetry-based mechanisms?","An inflationary potential can take different forms depending on the effects that break shift symmetries, leading to variations in the dynamics of inflation. In cases where there is no symmetry-based mechanism to address the single-field $\eta_V$-problem, accelerated expansion can still be realized through careful fine-tuning of parameters to enable cancellations among higher dimensional operators that could otherwise destabilize the solution."
21,"What is the $\eta_V$-problem in single-field inflation, and how is it typically addressed in the absence of symmetry-based solutions?","The $\eta_V$-problem in single-field inflation refers to the issue where higher-dimensional operators introduce corrections that can ruin the inflationary solution. In the absence of a symmetry-based mechanism, this problem is typically addressed through fine-tuning of parameters to allow for cancellations among these higher-dimensional operators, thus preserving the inflationary dynamics."
22,"How does the typical no-scale structure of type IIB flux compactifications impact the K""ahler moduli and their potential during inflationary scenarios?","In type IIB flux compactifications, the typical no-scale structure results in flat K""ahler moduli at tree-level, with the K""ahler moduli orthogonal to the overall volume mode enjoying an effective non-compact shift symmetry known as 'rhoshift'. This structure allows these other moduli to serve as promising inflaton candidates due to their flat directions at leading order."
23,"What are some of the effects that can break the shift symmetry of the K""ahler moduli and generate an inflationary potential in the context of type IIB flux compactifications?","The shift symmetry of the K""ahler moduli can be broken by various effects, such as $\mathcal{O}(\alpha'^3)$ corrections at the $(F$-${\rm term})^4$ level, $\mathcal{O}(\alpha'^4 g_s^2)$ string loop effects, or non-perturbative corrections. These effects play a crucial role in generating the inflationary potential along the flat directions of the K""ahler moduli orthogonal to the overall volume mode in type IIB flux compactifications."
24,"What are the key cosmological parameters obtained in the study mentioned in the text, and how do they constrain the inflationary model discussed?","In the study mentioned in the text (\cite{Cicoli:2020bao}), the values of the cosmological parameters $n_s$ and $r$ were determined to be $n_s = 0.9696^{+0.0010}_{-0.0026}$ and $r = 0.00731^{+0.00026}_{-0.00072}$ at $68\%$ CL for $N_e\simeq 52$ efoldings. These values provide constraints on the inflationary model under consideration by quantifying the spectral tilt of primordial scalar perturbations ($n_s$) and the tensor-to-scalar ratio ($r)."
25,How does the model discussed in the text incorporate moduli stabilization and what is the significance of globally consistent Calabi-Yau embeddings with chiral matter on D7-branes?,"The model discussed in the text incorporates moduli stabilization through the inflaton, which is the volume of a diagonal del Pezzo divisor resolving a singularity. Furthermore, the model features globally consistent Calabi-Yau embeddings with chiral matter on D7-branes. This embedding ensures the presence of chiral matter fields in the model, which play a crucial role in particle physics model building and could potentially have observational consequences."
26,"What are the mechanisms responsible for generating the inflationary potential in the model mentioned in the text, and how is the stability of the overall volume maintained during inflation?","In the inflationary model discussed in the text, the potential is generated by either Euclidean D3-instantons or gaugino condensation on D7-branes. These mechanisms provide the necessary energy scale for inflation to occur. Additionally, the stability of the overall volume during inflation is maintained by the presence of additional blow-up modes or through logarithmic loop corrections at $\mathcal{O}(g_s^2 \alpha'^3)$. This stability is crucial for ensuring the consistency and viability of the inflationary scenario within the broader string theory framework."
27,What is the significance of a sub-Planckian inflaton excursion in the context of inflationary models?,"Inflationary models with a sub-Planckian inflaton excursion are significant as they can lead to a very low Hubble scale and a negligibly small tensor-to-scalar ratio, providing a theoretical framework that can be tested against observational data to understand the dynamics of the early universe."
28,How do the loop or higher derivative corrections to the potential of the inflaton impact the flatness of the potential?,"Loop or higher derivative corrections to the potential of the inflaton can spoil its flatness, which is crucial for successful inflation. These corrections need to be either absent by design in the model or greatly suppressed by small coefficients to maintain the necessary flatness required for inflation to occur."
29,"How do multi-field inflationary models, such as the two-field generalisations considered in the text, differ from single-field models in terms of their predictions and observational implications?","Multi-field inflationary models, like the two-field generalisations discussed in the text, can lead to different predictions compared to single-field models. These models can exhibit more complex dynamics during inflation, impacting the scalar spectral index, the tensor-to-scalar ratio, and other observable quantities in ways that can be distinguished by observations, providing a richer framework to test against cosmological data."
30,What is the significance of the double inflation model proposed in the reference \cite{Kawasaki:2010ux} and how does it lead to a peak in the power spectrum at specific scales?,"The double inflation model proposed in \cite{Kawasaki:2010ux} is significant as it describes a scenario where there are two distinct inflationary periods. This leads to the production of a peak in the power spectrum at scales of observational interest. The model's post-inflationary evolution has been extensively studied to determine the number of efoldings of inflation, which in turn provides a prediction for the scalar spectral index."
31,"How do preheating effects post-inflation impact the evolution of the universe according to the model discussed, and what role does the formation of a thermal bath play in this scenario?","In the model discussed in the text, post-inflation preheating effects result in a violent non-perturbative production of inflaton self-quanta. These self-quanta then undergo perturbative decay, leading to the formation of a thermal bath. This process plays a crucial role in the transition from the inflationary phase to the subsequent stages of the universe's evolution."
32,How does the localization of the Standard Model on D7-branes affect the number of efoldings of inflation and the scalar spectral index in the context of the discussed model?,"The localization of the Standard Model on D7-branes wrapping the inflaton cycle has implications for the number of efoldings ($N_e$) and the scalar spectral index ($n_s$) in the model. For instance, when the Standard Model is situated in such a manner, it can lead to a specific number of efoldings and a corresponding scalar spectral index prediction. The configuration of the D7-branes and their intersection with the inflaton cycle are critical factors affecting the cosmological outcomes in this scenario."
33,What is the significance of the inflaton being the volume of a Wilson divisor in the model discussed in the text?,"The significance of the inflaton being the volume of a Wilson divisor in the model discussed in the text is that the superpotential includes highly suppressed poly-instanton contributions due to this topological property. These contributions lead to a naturally flat potential for the inflaton, which is crucial for successful inflationary models in theoretical physics."
34,"How does the structure of the inflaton potential in this model compare to other inflationary models, such as Fibre and Blow-up Inflation?","The structure of the inflaton potential in this model is characterized by the form $V = V_0(1-\kappa \phi e^{-\kappa\phi})$, where the predictions for tensor-to-scalar ratio and spectral index lie between those of Fibre and Blow-up Inflation. Specifically, the tensor-to-scalar ratio is approximately $r\simeq 10^{-5}$ and the spectral index is around $n_s\simeq 0.958$ at around $N_e\simeq 52$. This model provides an intermediate framework that differs from both Fibre and Blow-up Inflation in terms of inflationary predictions."
35,How do the continuous shift symmetries of closed string axions play a role in the model's scalar potential and the resulting accelerated expansion?,"The continuous shift symmetries of closed string axions are crucial in the model's scalar potential, as they are perturbatively exact symmetries that lead to a scalar potential structured as $V = V_0 [1 - \cos(\phi/f)]$. However, these continuous symmetries are broken by non-perturbative effects to discrete shift symmetries that scale as $V_0e^{-i\theta}$. This breaking results in the scalar potential enabling accelerated expansion only when the scale parameter $f$ exceeds the reduced Planck mass $M_{\rm Pl}$, highlighting the interplay between continuous symmetries and cosmological dynamics in the model."
36,"How does the scalar potential model, as described in the text, impact the prediction of cosmological observables?","The scalar potential model described in the text dictates the behavior of the field during inflation and influences the predictions for cosmological observables such as the scalar spectral index ($n_s$) and the tensor-to-scalar ratio ($r$). The value of the decay constant $\tilde{f}$ is crucial in determining the observational consequences of the model. For instance, for certain benchmark points like $N_e\simeq 52$, the requirement $r\lesssim 0.1$ constrains $\tilde{f}$ to be $\lesssim 8$, resulting in specific values for $n_s$ and $r."
37,How do larger or smaller values of the decay constant $\tilde{f}$ impact the theoretical consistency of the model and its predictions for cosmological observables?,"Larger values of the decay constant $\tilde{f}$ than allowed by observational bounds on $r$ can lead to tensions with existing data. On the other hand, smaller values of $\tilde{f}$ may result in a scalar spectral index that tends to be too low. This delicate balance between $\tilde{f}$ and the observational constraints is essential for ensuring the theoretical consistency of the model and its predictive power regarding cosmological observables."
38,"How does the utilization of combinations of different axions, such as $C_0$, $C_2$, and $C_4$ axions, impact the feasibility of constructing explicit models consistent with the observed cosmological data?","The combination of different axions, such as $C_0$, $C_2$, and $C_4$ axions, offers a potential avenue for constructing models that are globally consistent with observational data while maintaining theoretical viability. By leveraging these various axions, researchers can explore scenarios where the collective behavior of the axion fields results in an effective trans-Planckian decay constant, addressing challenges related to the field range and the theoretical underpinnings of the model. These approaches provide a richer framework for investigating inflationary scenarios within the context of type IIB string theory compactifications and offer possibilities for overcoming limitations posed by individual axions."
39,How does the collective motion of axions with sub-Planckian decay constants result in an effective trans-Planckian decay constant in the scenario described?,"In the scenario described, although individual axions have sub-Planckian decay constants, their collective motion leads to an effective trans-Planckian decay constant. This emergent trans-Planckian decay constant is a consequence of the interaction between the axions, allowing for unique properties and behaviors that would not be apparent on an individual axion basis."
40,"What role does the scalar potential, as given by $\Delta V = c\, V(\phi)\left(\frac{\phi}{\Lambda}\right)^2$, play in the model discussed?","The scalar potential $\Delta V = c\, V(\phi)\left(\frac{\phi}{\Lambda}\right)^2$ plays a crucial role in the model discussed as it dictates the dynamics of the axions and the resulting inflationary behavior. This potential is instrumental in generating the necessary conditions for slow-roll inflation and influences the overall inflationary predictions such as the spectral index and tensor-to-scalar ratio."
