,Question,Answer
85,How do string inflation models relate to experimental constraints and what implications does this have for their viability?,"Many string inflation models are already in tension with the latest experimental bounds on observational parameters like $\mathcal{O}(1)$4 and $\mathcal{O}(1)$5. This implies that these models may face challenges in being consistent with observational data unless modifications are introduced to better align with experimental bounds. Models such as axion monodromy and fibre inflation are slated to be further tested in planned experiments over the next 5-10 years, which will provide valuable insights into their viability and potential modifications needed."
86,"In the context of string inflationary scenarios, what distinguishes the classes of models focused on in the text from the broader set of string-inspired models present in the literature?","The classes of models focused on in the text represent the most developed string inflationary scenarios. These models have concrete proposals within the framework of string theory and have been studied extensively in terms of their theoretical implications and observational predictions. On the other hand, the broader set of string-inspired models in the literature includes proposals that are based on ideas from string theory but may lack a solid stringy embedding or detailed mechanisms for moduli stabilization. While these broader models contribute to the diversity of ideas in the field, they may not have the same level of theoretical development and predictive power as the more focused classes of string inflation models discussed in the text."
87,"What is the significance of the variety of inflation models mentioned in the text, from a theoretical perspective?","The variety of inflation models mentioned in the text is significant from a theoretical perspective because it showcases the diverse range of approaches taken to explain inflation within the framework of string theory. These models, although string-inspired or supergravity-inspired, offer unique insights and mechanisms for moduli stabilization that go beyond the traditional single-field inflation models. Exploring different inflationary scenarios is crucial for a comprehensive understanding of the early universe and for potential predictions that can be tested through observations."
88,How do these inflation models incorporate the presence of moduli fields from string theory compactifications?,"Many of the inflation models mentioned in the text incorporate moduli fields from string theory compactifications in various ways. Moduli fields are scalar fields that arise in string theory due to the geometry of extra dimensions. These fields play a crucial role in the stabilization of the compactification geometry and determining the low-energy physics in the effective field theory. Inflation models often interact with these moduli fields, either as the inflaton itself or in conjunction with other fields, leading to a rich interplay between different types of fields in the early universe dynamics."
89,What are some possible observational signatures or deviations that may arise from moving beyond the single-field inflation models?,"Moving beyond the traditional single-field inflation models into more complex scenarios can potentially lead to observable signatures that deviate from the standard predictions of inflation. For instance, non-Gaussianities, anisotropies, or inhomogeneities in the cosmic microwave background radiation could provide clues to the underlying physics of inflation. By exploring models that involve multiple fields, such as moduli fields or interactions beyond the inflaton sector, researchers can anticipate and study these potential deviations, offering a more comprehensive picture of the early universe and possibly revealing new aspects of fundamental physics."
90,How do multi-field dynamics in string theory models of inflation affect the inflationary mechanism?,"Multi-field dynamics in string theory models of inflation can have a significant impact on the inflationary mechanism. These dynamics involve a significant number of moduli and/or spin-1 fields with various masses that can be active during inflation. The evolution of these fields can contribute to the inflationary process at the background or fluctuation level, potentially influencing the properties of scalar and tensor modes by amplifying their spectra."
91,How does the inclusion of effects from angular directions in addition to the radial one impact D-brane inflation models?,"When effects from angular directions are considered alongside the radial direction in D-brane inflation models, it leads to the development of multi-field models of D-brane inflation. The potential for the D-brane becomes dependent on both the angular and radial directions. This additional complexity results in more intricate inflationary models that need to be explored further to understand their implications fully."
92,"What role does spinflation play in multi-field inflation models, and how does it contribute to the inflationary process?","In multi-field inflation models, concepts like spinflation come into play, where the Hubble friction is supplemented by retarding forces like centrifugal forces in certain scenarios, such as in the case of two-field inflation. Spinflation involves the inflatons orbiting towards the tip instead of directly rolling down the throat. The inflationary phase concludes once the inflatons lose their angular momentum, showing how spinflation can influence the dynamics of inflation in multi-field scenarios."
93,"How do quantum fluctuations of dynamical fields during inflation lead to entropy perturbations, and why is the coupling between adiabatic and entropy perturbations assumed to be very small in the described scenario?","Quantum fluctuations of dynamical fields during inflation can lead to entropy perturbations. The coupling between adiabatic and entropy perturbations is assumed to be very small to simplify the analysis, allowing the two types of perturbations to evolve independently. In the described scenario, the assumption of small coupling is made to study the impact of entropy perturbations on the overall inflationary dynamics without significant interference from the adiabatic mode."
94,"How does the amplitude of entropy perturbations relative to adiabatic fluctuations change in the limit described in the text, and how does the bispectrum amplitude change with respect to certain factors?","In the limit described in the text, the amplitude of entropy perturbations relative to adiabatic fluctuations is boosted. This means that the entropy perturbations become more pronounced compared to the adiabatic mode. The amplitude of the bispectrum in this scenario acquires a factor that depends on the speed of sound, the angle $\Theta$, and the factor $c_s^{-2}$, resulting in a specific expression that quantifies the non-Gaussian behavior of the perturbations."
95,"How do properties such as the inflationary trajectory bending, field space curvature, warp factor, and their derivatives influence the dynamics and phenomenology of perturbations in more general situations, and how does the ability of a D-brane to move in multiple directions impact the inflationary scenario?","In more general situations, properties such as the inflationary trajectory bending, field space curvature, warp factor, and their derivatives play crucial roles in determining the dynamics and phenomenology of perturbations during inflation. These properties affect the masses of adiabatic and entropy perturbations, as well as the coupling between them, thus influencing the overall behavior of the inflationary model. The ability of a D-brane to move in multiple directions inside the internal space introduces additional degrees of freedom that can significantly impact the inflationary scenario, allowing for more complex dynamics and potential observational consequences."
96,What are the main findings regarding the two field phenomenology of warped D3-brane inflation based on the numerical computations mentioned in the text?,"The main findings regarding the two field phenomenology of warped D3-brane inflation based on numerical computations indicate that in trajectories of prolonged inflation, angular motion is relevant during the first few e-foldings of inflation, becoming exponentially suppressed afterward. Models consistent with observable values of the spectral tilt had the inflaton energy scale falling within a certain range, and the tensor-to-scalar ratio was generally very small. Additionally, large non-Gaussianities were rare in these scenarios."
97,How does the two field model of D5-brane inflation described in the text differ from the standard single field inflation models?,"The two field model of D5-brane inflation described in the text differs from standard single field inflation models by considering the dynamics of two fields in the inflationary scenario. This model involves a D5-brane moving along a single angular direction of a warped resolved conifold, realizing natural inflation. The two field dynamics allow for two types of inflationary trajectories: an almost geodesic trajectory and a strongly non-geodesic trajectory, wherein the masses of the two fields play a crucial role."
98,How does the field space metric impact the dynamics of the two field D5-brane inflation model discussed in the text?,"In the two field D5-brane inflation model discussed in the text, the field space metric has a significant impact on the dynamics. The field space metric depends non-trivially on the radial direction, giving rise to a negatively curved space. This non-trivial metric influences the behavior of the fields during inflation and affects the trajectories followed by the fields in the model."
99,What are the differences in cosmological predictions between the almost geodesic and strongly non-geodesic trajectories discussed in the text?,"The text discusses how the cosmological predictions differ between almost geodesic and strongly non-geodesic trajectories. For the almost geodesic case, the spectral tilt and tensor-to-scalar ratio predictions are similar to single-field natural inflation, but the non-Gaussianity parameter is too large and in tension with Planck constraints. On the other hand, in the strongly non-geodesic case, the predictions for non-Gaussianity are modified, and some values can be consistent with the Planck data."
100,How does the non-geodesic behavior impact the cosmological predictions in multi-field inflation models?,"The text mentions that in strongly non-geodesic cases, the predictions for the non-Gaussianity parameter are altered compared to the almost geodesic scenarios. Specifically, some values can be consistent with the Planck data in the strongly non-geodesic case. This suggests that the nature of trajectory, either geodesic or non-geodesic, plays a crucial role in determining the cosmological predictions in multi-field inflation models."
101,What is the significance of the instantaneous axion decay constant $\eta_V$ in the context of the discussed multi-field inflation models?,"In the context of the discussed multi-field inflation models, the instantaneous axion decay constant $\eta_V$ plays a critical role. It is mentioned that $\eta_V$ depends on the parameters of the model and can influence the cosmological predictions, particularly in relation to non-Gaussianities. By understanding and characterizing the behavior of $\eta_V$, researchers can gain insights into the dynamics and implications of the multi-field inflation models under consideration."
102,"What is the modulated reheating scenario and how is it realized in string theory, as mentioned in the text?","The modulated reheating scenario involves a modulation field affecting the reheating process after inflation. In the string theory realization presented in the text \cite{Cicoli:2012cy}, inflation is driven by a fibre modulus while a blow-up mode acts as the modulating field."
103,"How can a vector field play the role of the curvaton field, and why might its contribution lead to statistically anisotropic curvature perturbations?","A vector field can serve as the curvaton field, affecting the curvature perturbations. In the scenario discussed in \cite{Dimopoulos:2006ms,Dimopoulos:2011ws}, the vector field contribution to the curvature perturbation is statistically anisotropic, as shown in the reference \cite{Dimopoulos:2008yv}."
104,"What role does the dilaton play in the vector curvaton scenario in D3-brane models of inflation, and why is the inclusion of statistical anisotropies important in current cosmological studies?","In the vector curvaton scenario in D3-brane models of inflation, the dilaton is considered a spectator field that modulates the evolution of the vector field. The inclusion of statistical anisotropies in current cosmological studies, as hinted by Planck constraints \cite{Planck:2015igc}, is important for understanding the full range of possibilities in cosmological models, such as the vector curvaton scenario discussed in the text."
105,How does the introduction of the Chern-Simons (CS) coupling between a rolling axion and a non-Abelian gauge field affect the dynamics of the axion field in the context of chromonatural inflation?,"The Chern-Simons coupling between the axion field and a non-Abelian gauge field introduces a friction term that 'slows down' the axion field dynamics. This friction term affects the evolution of the axion field during chromonatural inflation, allowing natural inflation to proceed even with a sub-Planckian decay constant or in a steeper potential."
106,"In the context of chromonatural inflation, how do fluctuations in the gauge field contribute to the generation of tensor and scalar modes, and why is this significant?","Fluctuations in the gauge field during chromonatural inflation source both tensorial and scalar perturbations. This is significant because the tensor modes experience a transient growth in one of their polarizations, enhancing the amplitude of gravitational waves. The production of a chiral tensor spectrum in this scenario is distinguishable from the tensor spectrum that arises in regular inflationary scenarios."
107,How do the additional source of primordial gravitational waves (PGW) in chromonatural inflation enable observable levels of gravitational wave production even with sub-Planckian field excursions?,"The presence of the Chern-Simons coupling and the accompanying fluctuations in the gauge field lead to the production of additional primordial gravitational waves (PGW) in chromonatural inflation. These PGWs can be produced at observable levels even with sub-Planckian field excursions, effectively evading constraints like the Lyth bound, due to the enhanced production of gravitational waves from the transient growth of tensor modes."
108,Can you explain the significance of the proposed Spectator ChromoNatural Inflation (SCNI) model in the context of addressing the limitations identified in ChromoNatural Inflation (CNI)?,"The proposed SCNI model aims to separate the inflationary sector from the gauge-axion sector, with the gauge-axion sector acting as a spectator. This separation helps in addressing the challenges faced by CNI, particularly in satisfying both the bounds on $\eta_V$7 and the scalar spectral index $\eta_V$8, which were shown to be difficult to satisfy simultaneously in CNI."
109,How does the requirement for a large axion-gauge Chern-Simons (CS) coupling in SCNI impact the theoretical challenges and parameter space of the model?,"The large axion-gauge CS coupling, represented by the parameter $\frac{\lambda }{4f} \,\chi\,F_{\mu u}^A\tilde F^{A\,\mu u}$, is crucial for successful SCNI. However, achieving the required parameters such as sub-Planckian decay constants, small gauge couplings, and emphasizing $Lambda \ll M_{\rm Pl}$ within the model poses a significant theoretical challenge. Meeting these requirements is essential for maintaining a consistent background evolution and generating observable levels of primordial gravitational waves without excessive backreaction."
110,"In the context of string theory compactifications, how feasible is it to realize the SCNI model successfully within a UV complete theory, and what are the primary obstacles that need to be overcome?","Within string theory compactifications, the incorporation of axions and non-Abelian gauge fields, which are fundamental in the SCNI model, is common. However, realizing the SCNI model successfully within a UV complete theory involves challenges related to achieving specific parameter values and addressing theoretical constraints. Some recent attempts in the literature have explored embeddings of models similar to CNI within supergravity frameworks, indicating ongoing efforts to overcome these challenges and realize such inflationary scenarios in a UV complete setting."
111,What is the motivation behind adding an inflationary sector to the CNI setup in the mentioned works?,"The motivation behind adding an inflationary sector to the CNI setup is to construct a model of SCNI (single-clock natural inflation) where inflationary dynamics can be studied. This allows for a more comprehensive analysis of the viability and phenomenology of the model, especially when incorporating additional fields."
112,"How does the model presented in \cite{McDonough:2018xzh} embed SCNI into a string theory scenario, and what are the considerations made regarding gauge field tensor fluctuations?","The model in \cite{McDonough:2018xzh} embeds SCNI into a string theory scenario by considering gaugino condensation on magnetised D7-branes in type IIB CY orientifold compactifications. The axion associated with the 2-form potential present in the compactification is utilized. However, the backreaction of the gauge field tensor fluctuations on the background was not explicitly considered in the analysis."
113,"What are the key requirements discussed in \cite{Holland:2020jdh} for a successful realisation of the SCNI scenario in explicit string theory setups, and how do they impact the model construction?","In \cite{Holland:2020jdh}, the key requirements for a successful realization of the SCNI scenario in explicit string theory setups were outlined. These include the need for a successful background evolution, a significant enhancement of tensor fluctuations for future experiment detectability, and controllable backreaction from gauge field tensor fluctuations. These requirements influence the construction of the model and shape the analysis of its viability in the context of string theory scenarios."
114,"What are the main considerations in embedding fibre inflation into a multi-field K""ahler inflation model, and what additional components are needed to achieve SCNI?","In embedding fibre inflation into a multi-field K""ahler inflation model, three K""ahler moduli are required. To achieve Single-Component Natural Inflation (SCNI), a fourth K""ahler modulus and a spectator sector need to be introduced. The spectator sector necessitates gaugino condensation on a multiply-wrapped magnetised stack of $\mathcal{O}(1)$ D7-branes with gauge field fluctuations coupling to a $\mathcal{O}(1)$ axion."
115,"What specific parameters play a crucial role in achieving successful SCNI in the context of the described model, and what are typical values assigned to these parameters?","The necessary parameters for achieving successful SCNI include the magnetic flux on the D7-brane stack, the degree of the condensing group, and the wrapping number. Typical successful values for these parameters are of the order of $\mathcal{O}(1)$. For the fibre inflation case, the typical values of these parameters are slightly improved, around $\mathcal{O}(1)$, offering a larger tensor-to-scalar ratio."
116,"How does axion monodromy inflation compare to other inflation scenarios, and what are some of the key aspects of its phenomenology, particularly in the context of multi-field extensions?","Axion monodromy inflation represents an intriguing scenario due to its rich phenomenology, especially when considering multi-field extensions. Although explicit string theory constructions are not available, axion monodromy inflation has been studied in field theory models and realisations in supergravity. Similar to N-flation, axion monodromy inflation can involve multiple axions with broken shift symmetries at tree-level, generating a leading power-law term."
117,What is the significance of the spectral index being shifted red-wards from the single-field predictions in the context of inflationary models with multiple axions?,"The spectral index in inflationary models with multiple axions being shifted red-wards from single-field predictions is significant because it provides a unique signature of such models. This shift indicates deviations from traditional inflationary paradigms and can potentially offer a way to differentiate between single-field and multiple-field inflationary scenarios based on observational data, such as cosmic microwave background (CMB) constraints."
118,"How do rollercoaster cosmology models, involving multiple stages of inflation separated by non-inflating epochs, contribute to our understanding of the inflationary paradigm?","Rollercoaster cosmology models, which feature multiple stages of inflation interspersed with non-inflating eras, offer a rich framework to explore the dynamics of the early universe. By allowing for distinct phases of inflation and non-inflation, these models provide opportunities to address theoretical and observational challenges in cosmology, such as realizing specific features in the primordial power spectrum that may be difficult to achieve with single-stage inflation models."
119,"In the context of axionic inflation, how does the coupling of the first inflaton to a vector field affect the generation of chiral tensor modes and their potential detectability by gravitational wave experiments?","The coupling of the first inflaton to a vector field in axionic inflation scenarios can lead to the production of chiral tensor modes. These tensor modes, arising during intermediate matter epochs, have a specific handedness (chirality) due to the coupling mechanism involved. The potential detectability of these chiral tensor modes by future gravitational wave experiments at varying scales offers a unique probe into the physics of inflation and could provide valuable insights into the fundamental interactions that governed the early universe."
120,How does the axion-saxion system evolve cosmologically and what are the interesting effects studied in the model mentioned in the text?,"The axion-saxion system can evolve cosmologically with interesting effects such as transient violations of slow-roll, leading to non-geodesic motion without the requirement of a large field space curvature. This evolution was studied in a supergravity model with an axion-saxion system that displayed non-trivial dynamics leading to enhancements in the adiabatic power spectrum and the possibility of producing primordial black holes (PBHs) and induced gravitational waves (GWs)."
121,What is the significance of non-geodesic trajectories in the context of supergravity models and how do they relate to field space curvatures?,"In the context of supergravity models, strong non-geodesic trajectories are important as they do not necessarily require large field space curvatures for their occurrence. The transient violations of slow-roll causing non-geodesic motion are related to modulations in the scalar potential, leading to unique and interesting cosmological effects."
122,"Can you elaborate on the potential provided in the text for the axion and saxion fields, and how do these fields manifest in the evolution of the system?","The potential described in the text is a function of the axion and saxion fields, where the leading terms for both fields are quadratic. This potential leads to the non-trivial evolution of the axion-saxion system, resulting in enhancements in the adiabatic power spectrum at small scales, resonant features, and the potential production of PBHs and GWs. The interaction between the fields as described by the potential plays a crucial role in shaping the cosmological evolution of the system."
123,Can you explain the significance of the inflationary trajectory as shown on the inflationary trajectory diagram (fig:VMAM)?,"The inflationary trajectory depicted in the diagram (fig:VMAM) represents the evolution of the scalar field during cosmic inflation. Understanding this trajectory is crucial as it determines the expansion rate of the universe, the generation of density perturbations, and the production of gravitational waves. Researchers analyze the shape and behavior of this trajectory to gain insights into the specific inflationary model being considered."
124,"How do the adiabatic and gravitational wave spectra vary with different parameters, as illustrated in the spectra diagram (fig:psgw)?","The adiabatic and gravitational wave spectra provide information about the primordial perturbations and gravitational wave signals generated during inflation. By examining the spectra for various parameter values, researchers can study how different inflationary scenarios affect the primordial power spectrum, tensor-to-scalar ratio, and spectral index. Understanding these variations helps in constraining inflationary models and comparing them with observational data."
